Title,Detail,Date,Price(in dollar),Offer price(in dollar),Review and rating,Number of bed
"Chalet in Skykomish, Washington, US",Sky Haus - A-Frame Cabin,Jun 11 - 16,306.00,229.00,4.85 (531),4 beds
"Cabin in Hancock, New York, US",The Catskill A-Frame - Mid-Century Modern Cabin,Jun 6 - 11,485.00,170.00,4.77 (146),4 beds
"Cabin in West Farmington, Ohio, US",The Triangle: A-Frame Cabin for your city retreat,Jul 9 - 14,119.00,522.00,4.91 (515),4 beds
"Home in Blue Ridge, Georgia, US",*Summer Sizzle* 5 Min to Blue Ridge* Pets* Hot tub,Jun 11 - 16,192.00,348.00,4.94 (88),5 beds
"Treehouse in Grandview, Texas, US",Luxury Treehouse Couples Getaway w/ Peaceful Views,Jun 4 - 9,232.00,196.00,4.99 (222),1 queen bed
"Tiny home in Puerto Escondido, Mexico",Casa Tiny near Casa Wabi,Jun 21 - 26,261.00,148.00,4.84 (555),1 double bed
"Home in Saco, Maine, US",The Beach House. Oceanfront & Sunrise Views!,Jun 4 - 9,607.00,,4.64 (90),2 queen beds
"Chalet in Grand Étang, Canada",• Cedar Peak • 2 Bedroom Barrier-Free Chalet,Jun 8 - 15,381.00,,5.0 (48),2 beds
"Room in Mexico City, Mexico","Room in apartment, traditional neighborhood",Jul 3 - 8,29.00,,4.84 (58),2 beds
"Tiny home in Sandy Valley, Nevada, US",Peacock Tiny House near Las Vegas,Jun 26 - Jul 1,154.00,,4.92 (744),3 beds
"Guest suite in Huntsville, Canada",Hidden Valley’s Guest Suite - explore nature,Sep 4 - 10,207.00,,4.97 (265),2 beds
"Cabin in Nelson, Canada",Downey Family Cabin. Barrel Sauna Included!,Jun 1 - 6,162.00,,4.99 (226),2 king beds
"Dome in Joshua Tree, California, US",Dome in the Desert in Joshua Tree,Jun 1 - 6,268.00,,4.94 (944),1 king bed
"Barn in Vero Beach, Florida, US",Private Barn Studio at Pura Vida Florida Farm,Sep 11 - 16,111.00,,4.95 (417),2 double beds
"Tiny home in Bolton, Vermont, US",Cozy Tiny House Cabin between Burlington and Stowe,Jun 1 - 6,174.00,,4.97 (372),2 queen beds
"Cabin in Ucluelet, Canada",Peace Cabin - private waterfront forest retreat,Sep 8 - 13,497.00,,4.99 (69),1 king bed
"Barn in Essex, Canada",14th Homestead Barn Loft,Jun 11 - 16,163.00,,4.9 (289),1 king bed
"Apartment in Bacalar, Mexico","Lagoon Front Hut: Daily Cleaning, Bikes & Kayaks!",Jun 18 - 23,141.00,,4.89 (633),1 king bed
"Treehouse in Travelers Rest, South Carolina, US",The Forestry House - A modern luxury treehouse.,Aug 20 - 25,282.00,417.00,New,1 bed
"Farm stay in Del Norte County, California, US",Underground Hobbit Hole @ Sustainable Ecovillage,Jun 9 - 14,89.00,253.00,4.54 (195),1 bed
"Treehouse in San Carlos, Costa Rica",Rainforest Tree House with Hot Springs,Aug 31 - Sep 5,132.00,,4.84 (763),3 beds
"Treehouse in Frazeysburg, Ohio, US",Tullihas in the Trees Off-Grid Treehouse,Jun 4 - 9,143.00,,4.98 (181),2 beds
"Cabin in Rodney, Canada",SECLUDED LAKESIDE CABIN,Jul 23 - 28,463.00,,4.99 (172),3 beds
"Room in La Habana, Cuba",Fauria Colonial House (Room 3),Jun 21 - 26,29.00,,4.92 (75),1 bed
"Dome in Terlingua, Texas, US",Domeland: Off-grid Adobe Dome near Big Bend,Jul 9 - 14,136.00,,4.95 (863),5 beds
"Home in Port Angeles, Washington, US",Lake Sutherland Waterfront Cabin w/ Expansive Dock,Sep 1 - 6,688.00,,4.82 (83),1 king bed
"Treehouse in Fredericksburg, Texas, US",Luxury Tree House X Magical Romantic Forest! Pool!,Jun 18 - 23,658.00,,4.91 (142),1 king bed
"Cottage in Harcourt, Canada",Scandinavian-Inspired Tiny Home Experience,Sep 3 - 8,392.00,,4.98 (95),2 beds
"Tiny home in Medellín, Colombia",Tiny House Cubo Nube Santa Elena 40 min. Medellin.,Jun 17 - 22,67.00,,4.95 (197),1 queen bed
"Cabin in Medellín, Colombia",Chalet Boutique Saltamontes Santa Elena,Jun 4 - 9,51.00,,4.94 (232),2 beds
"Cabin in Bryson City, North Carolina, US",Secluded View! A-Frame Hot Tub and Fire Pit,Jun 19 - 24,354.00,,4.95 (20),1 queen bed
"Place to stay in Retiro, Colombia",★ BubbleSky Glamping ★ One Night Under Stars ★3,Jun 23 - 28,107.00,,4.9 (154),2 king beds
"Cabin in Bluefields, Jamaica",Cozy Oceanview Cabin,Jul 14 - 21,102.00,,4.88 (76),1 king bed
"Hut in Bavaro, Dominican Republic",Hut #1 Romantic Luxury Beachfront,Jul 1 - 6,171.00,,4.89 (377),2 beds
"Treehouse in Marion, North Carolina, US",Treehouse w/Breathtaking Views+HotTub+Hiking+Falls,Aug 12 - 17,286.00,,5.0 (21),1 queen bed
"Dome in Sandgate, Vermont, US",“Whimsical Stone Abode” - Boston Magazine,Jun 6 - 11,301.00,,5.0 (244),1 queen bed
"Condo in Puerto Vallarta, Mexico",Buddha Loft in Romantic Zone of Puerto Vallarta,Jul 12 - 17,112.00,146.00,4.85 (175),1 bed
"Cabin in Sanbornton, New Hampshire, US",The G Frame...an offGrid Cabin + woodstove sauna,Jun 4 - 9,169.00,"1,089.00",4.96 (395),2 king beds
"Room in La Habana, Cuba",Casa Blanca B&B with beautiful terrace &sea views,Sep 11 - 16,43.00,630.00,4.82 (359),2 king beds
"Home in Moss Beach, California, US",Walk to the Beach from this Ocean Front Home,Jun 1 - 6,"1,463.00",225.00,4.94 (149),9 beds
"Cottage in Wheatley, Canada","Cozy Modern Beach House w/ Pool, Hot Tub & More!",Jun 4 - 11,764.00,819.00,4.74 (19),2 queen beds
"Cabin in Topanga, California, US","Crystal Cabin, Restored Vintage Lodge in Topanga State Park",Jun 3 - 8,225.00,,4.94 (209),1 double bed
"Chalet in Cajicá, Colombia",Casa Anís,Jun 1 - 6,40.00,,4.96 (202),3 beds
"Cabin in Center Conway, New Hampshire, US",Warm Pine A-frame Nestled In The Trees!,Jul 1 - 6,287.00,,4.79 (536),1 double bed
"Cottage in Renous, Canada",Hambrook Point Cottage “Homestead”,Jun 25 - 30,93.00,,4.87 (360),3 beds
"Tiny home in Huntsville, Missouri, US",O’s Barn Cabin,Jul 4 - 9,118.00,,4.94 (296),2 double beds
"Tiny home in Castleton, Canada",Artsy "Glamping" experience,Jul 21 - 26,138.00,,4.91 (278),3 beds
"Cottage in Bodega Bay, California, US","Seamist Beach Cottage, Private Beach & Ocean views",Aug 13 - 18,670.00,,4.7 (256),2 beds
"Cabin in Rocky View County, Canada",100+ Year old Rustic Log Cabin near Ghost Lake,Aug 25 - 30,135.00,,4.83 (459),1 sofa bed
"Houseboat in Low, Canada",The Dragon + Private Island,Jun 1 - 6,178.00,,4.87 (61),1 queen bed
"Guesthouse in Key Largo, Florida, US","Private Cottage, enjoy beach, sunsets & fishing.",Jul 11 - 16,218.00,,4.89 (314),3 beds
"Condo in Malibu, California, US","Malibu, Carbon Beach - Suite Seven",Jun 6 - 13,898.00,,4.86 (311),2 queen beds
"Cottage in Petit-Tracadie, Canada",Waterfront Cottage #1 /Waterfront cottage,Jun 4 - 9,144.00,,4.92 (267),2 queen beds
"Cabin in Jarratt, Virginia, US",Harrell’s Cabin,Jun 4 - 9,125.00,,4.82 (612),2 queen beds
"Cabin in El Peñol, Colombia",6 Ibuku Big Cabin by Lake Jacuzzi Kayak,Jun 12 - 17,220.00,372.00,4.93 (46),7 beds
"Guest suite in North Vancouver, Canada",The Brite House - Oceanfront Sojourn,Jun 6 - 11,305.00,251.00,4.87 (319),3 beds
"Home in Shirley, Canada",♨ Cedar Coast Lodge - Coastal retreat w/ HOT TUB,Jun 4 - 9,480.00,290.00,4.82 (125),5 beds
"Apartment in Miami, Florida, US","LUXURY 5★s ICON BRICKELL CONDO@47TH, GYM/POOL",Jun 27 - Jul 4,398.00,265.00,4.89 (605),2 beds
"Room in Kansas City, Missouri, US",Mansion in the Park - garden view queen en suite,Jun 4 - 10,148.00,39.00,4.99 (93),3 queen beds
"Dome in Lac-Supérieur, Canada",Dome L'Albatros | Private Spa | BBQ Zone,Jul 25 - 31,322.00,232.00,4.86 (196),6 beds
"Chalet in Saint-Damien, Canada",The Majesta ! Incredible Sunset !,Jun 1 - 6,315.00,78.00,5.0 (11),1 king bed
"Home in Tulum, Mexico","Heaven Lodge, entire house surrounded by nature",Jun 2 - 7,128.00,,4.86 (155),1 king bed
"Apartment in Tulum, Mexico",☆King Bed Apartment☆ Suk-Ha ☆ La Veleta,Jun 1 - 6,55.00,,4.6 (73),4 beds
"Chalet in Durham, Canada",Newly-Constructed Riverfront Chalet,Jun 4 - 9,360.00,,4.97 (95),2 beds
"Tent in Island Park, Idaho, US","Yellowstone Luxury Tent; sleeps 3, 1 king +1 futon",Jun 15 - 20,224.00,,5.0 (31),2 queen beds
"Cabin in Arrowbear Lake, California, US",A-Frame Apogee | Hot Tub · Epic Views · Swing Set,Jun 19 - 24,227.00,,4.96 (166),1 queen bed
"Home in Borinquen, Puerto Rico",The Nest at Crash Boat. Only waterfront on Beach,Aug 7 - 12,363.00,,4.9 (143),3 beds
"Cottage in Wasaga Beach, Canada",Cozy Riverfront Cottage Retreat with Dock,Jun 11 - 16,232.00,,4.84 (55),1 bed
"Tiny home in Blockhouse, Canada",The Ruby -A Rustic Red Ark tiny home,Jun 18 - 23,81.00,,4.98 (43),2 beds
"Guesthouse in Peachland, Canada",Romantic lakefront estate with lake view & deck,Jun 2 - 7,271.00,,5.0 (311),2 beds
"Cabin in Shaftsbury, Vermont, US",The Vermont Dream Cabin on 70 Acres,Jun 4 - 9,219.00,,4.89 (136),1 king bed
"Cabin in Tulum, Mexico",Jungle Lodge at Nahouse in Tulum,Jun 1 - 6,109.00,,None,1 king bed
"Dome in Windermere, Canada",Cougar Dome at Winderdome Resort!,Aug 27 - Sep 1,335.00,223.00,5.0 (16),3 beds
"Condo in Myrtle Beach, South Carolina, US",Cool Clean Condo with Brilliant Oceanfront View,Jun 25 - Jul 1,261.00,63.00,4.58 (108),2 beds
"Hotel room in Laguna Beach, California, US",Beachfront Laguna Beach Magnificent Oceanviews 26,Jun 1 - 6,287.00,228.00,4.38 (396),2 queen beds
"Apartment in Playa del Carmen, Mexico","Su mejor opción en Playa del Carmen, a pasos de la quinta av.",Jun 4 - 9,89.00,198.00,4.78 (231),2 beds
"Tiny home in Maynooth, Canada",Cozy Cabin #2 - private cabin in the wilderness!,Jun 4 - 9,71.00,141.00,4.89 (90),2 beds
"Guesthouse in Cabo Rojo, Puerto Rico",Villa Vista Puerto,Jun 26 - Jul 1,138.00,169.00,4.86 (493),2 sofa beds
"Tiny home in Canning, Canada",Split View Two,Aug 2 - 7,134.00,,4.95 (81),1 double bed
"Cottage in Luquillo, Puerto Rico",The Sugar Shack a unique cabin in the Rainforest,Sep 4 - 9,75.00,,4.92 (447),2 beds
"Condo in Lahaina, Hawaii, US",Noelani-My Perfect Stays Special: Jun 9-16 $189,Jun 9 - 14,302.00,,4.82 (71),1 king bed
"Condo in Hollywood, Florida, US",Amazing Hyde One-bedroom apartment on the Beach,Jun 4 - 9,248.00,,4.56 (62),2 beds
"Cabin in Naples, New York, US",East hill cabins #1,Jun 11 - 16,91.00,,4.82 (334),2 beds
"Campsite in Nemaiah Valley, Canada",Sunset Wilderness Camp,Jun 1 - 6,34.00,,4.0 (3),1 bed
"Loft in The Blue Mountains, Canada",Chateau Ridge Chalet w/ Mountain View,Jun 5 - 12,154.00,,4.84 (95),4 beds
"Loft in The Blue Mountains, Canada",Cozy Blue Mountain Retreat @!@Spring Rates@!@,Jun 4 - 9,118.00,,4.72 (365),2 queen beds
"Room in Mexico City, Mexico",5 min to Airport with Terrace in a Safe area !,Jun 3 - 8,31.00,,4.85 (227),1 queen bed
"Tiny home in Komoka, Canada",The Cabin at Fernwood Hills,Jun 11 - 16,112.00,,4.9 (597),1 king bed
"Place to stay in Punta Cana, Dominican Republic",Hut #3 Romantic Luxury on the sand,Jul 11 - 16,132.00,,4.86 (29),2 beds
"Home in Hilbert, Wisconsin, US",State Park A-Frame with Hiking Trails & Arcade,Jun 4 - 9,239.00,,4.97 (29),2 beds
"Dome in Whittier, North Carolina, US",Luxury Dome w/ Hot Tub & Mountain View,Aug 7 - 12,291.00,169.00,5.0 (11),2 beds
"Place to stay in Punta Cana, Dominican Republic",Hut #3 Romantic Luxury on the sand,Jul 11 - 16,132.00,42.00,4.86 (29),1 king bed
"Home in Hilbert, Wisconsin, US",State Park A-Frame with Hiking Trails & Arcade,Jun 4 - 9,239.00,132.00,4.97 (29),2 beds
"Home in Puntarenas Province, Costa Rica",House with pool in the heights of Santa Teresa,Jun 4 - 9,230.00,47.00,5.0 (6),3 beds
"Loft in Monteverde, Costa Rica",Kapetsowa Container Loft near Monteverde Reserve,Sep 5 - 10,159.00,161.00,4.87 (396),2 queen beds
"Nature lodge in Quesada, Costa Rica",Cabin Over a water fall,Jun 5 - 10,82.00,,4.94 (133),1 bed
"Boat in Key West, Florida, US",Cozy Houseboat “Wild One”,Jun 11 - 16,233.00,,5.0 (4),2 beds
"Cabin in Zapotal, Costa Rica",Pipe’s Lodge,Jun 4 - 9,51.00,,4.87 (31),1 double bed
"Guesthouse in Destin, Florida, US",New Carriage House * 1 Block to Beach * King Bed!,Aug 13 - 18,231.00,,New,1 king bed
"Tiny home in Playa Hermosa, Costa Rica",Beachfront Bungalow with private hydromassage Pool,Jul 3 - 9,162.00,,4.95 (149),1 queen bed
"Home in Bellingham, Washington, US",Bellingham A-Frame - Hot tub & Firepit,Jun 11 - 16,232.00,,New,2 beds
"Apartment in San Juan, Puerto Rico","Villa Bohème 3, 1BR with Patio",Jul 8 - 13,115.00,,New,1 bed
"Loft in Mexico City, Mexico",Loft Boutique Cd de México Mountain view 🏔,Jul 9 - 14,57.00,,4.84 (155),1 queen bed
"Cabin in Gold Bar, Washington, US",New lux cabin w/mount index view,Jun 25 - 30,253.00,,4.86 (7),2 beds
"Home in Malibu, California, US",Guesthouse Great Ocean & Mountain Views near Beach,Jul 31 - Aug 5,468.00,,4.87 (694),1 queen bed
"Tiny home in Orlando, Florida, US",The Little Tree House at Country Club of Orlando,Jul 9 - 14,127.00,,4.98 (604),1 queen bed
"Boat in Marathon, Florida, US",Paradise awaits on this cozy houseboat!,Jul 17 - 22,276.00,,4.77 (98),1 king bed
"Hut in Uvero Alto - Bavaro - Punta Cana, Dominican Republic",Hut #2 Romantic Luxury on the sand,Aug 1 - 6,186.00,,4.94 (226),2 beds
"Loft in Mazamitla, Mexico",Loft ALAMO /El Refugio Cabañas Mazamitla,Jun 25 - 30,58.00,161.00,4.44 (146),2 king beds
"Hut in Uvero Alto - Bavaro - Punta Cana, Dominican Republic",Hut #2 Romantic Luxury on the sand,Aug 1 - 6,186.00,192.00,4.94 (226),2 beds
"Apartment in Punta Cana, Dominican Republic",Pool View Beach Residence / Private Beach Access,Jun 21 - 26,37.00,132.00,4.71 (156),1 queen bed
"Treehouse in Wardensville, West Virginia, US",Eagles Nest Treehouse w/Hot tub!,Jun 4 - 10,244.00,63.00,New,3 beds
"Boat in Stuart, Florida, US",Modern Houseboat On the water,Aug 6 - 11,173.00,49.00,4.97 (264),1 bed
"Apartment in Playa del Carmen, Mexico",BoHo lofts & studios new modern w/ ocean-view pool,Jun 1 - 7,38.00,,4.59 (183),1 queen bed
"Condo in Miami Beach, Florida, US",Oceanfront 14th Floor Brand New Beachfront Flat,Jun 14 - 19,302.00,,4.85 (646),2 beds
"Earthen home in Weaverville, North Carolina, US",Hobbithenge,Jun 5 - 10,142.00,,4.83 (304),1 double bed
"Shipping container in Playa Hermosa, Costa Rica",Beachfront Bungalow w/ private hydromassage pool 2,Jun 10 - 15,147.00,,4.9 (68),2 beds
"Cabin in Marion, North Carolina, US","Luxury Treehouse, Romantic, Views, Hike-Waterfall",Jul 29 - Aug 3,228.00,,5.0 (18),1 bed
"Camper/RV in Half Moon Bay, California, US",Quiet and Private Retreat in a 1967 Airstream on the Coast.,Jun 25 - 30,220.00,,4.93 (347),2 beds
"Dome in Hiawassee, Georgia, US",Tiny Dome River Glamping Experience,Jun 18 - 23,143.00,,4.86 (289),1 queen bed
"Apartment in San José, Costa Rica",New Boho Sabana Apartment Close to Airports w/ AC,Jun 23 - 28,89.00,,4.85 (81),1 bed
"Condo in Rosarito, Mexico",Elegant Ocean Front Condo! Rosarito Beach !WOW!!,Jun 10 - 15,171.00,,4.81 (245),2 queen beds
"Condo in Atlantic City, New Jersey, US",Highest Reviewed - Ocean Front + Free Parking!,Jun 18 - 23,170.00,,4.85 (278),2 queen beds
"Cabin in Santa Marta, Colombia",The Dawn of Annapurna Cabin,Jul 29 - Aug 3,61.00,,4.87 (188),1 queen bed
"Home in Cabo San Lucas, Mexico","Cabo Center,Ocean view Great price!",Jun 6 - 11,55.00,,4.94 (615),1 king bed
"Home in Kawartha Lakes, Canada",nortehaus - Nordic and Japanese inspired escape,Jun 18 - 23,402.00,,5.0 (24),2 queen beds
"Loft in Cholula, Mexico",Architect's Loft in Cholula,Jun 18 - 23,32.00,25.00,4.81 (202),1 queen bed
"Cabin in Jacó, Costa Rica",Jungle house 3km to Jaco beach & town center,Jun 30 - Jul 5,76.00,67.00,4.84 (153),2 queen beds
"Tiny home in Malibu, California, US","Malibu Charming GH, Mins Drive to Beach & Hike",Jul 22 - 27,332.00,85.00,4.78 (558),1 queen bed
"Apartment in Orlando, Florida, US",Studio near Disney,Jun 10 - 15,80.00,266.00,4.43 (132),1 king bed
"Treehouse in Río Grande, Puerto Rico",Charming Treehouse with Pool,Sep 10 - 15,217.00,330.00,5.0 (172),1 bed
"Loft in Mazatlán, Mexico",Oceanfront loft,Jun 10 - 15,100.00,253.00,4.92 (177),2 beds
"Apartment in Cancún, Mexico",Majestic Ocean Front Terrace II,Jul 23 - 29,57.00,,4.83 (240),2 queen beds
"Home in Real Montecassino, Mexico",New! Bamboo Bosque Mio (Stars & Campfires),Jun 4 - 9,113.00,,4.82 (56),3 beds
"Cottage in Huntsville, Canada","Cabin for 2 w/ Hot Tub, Muskoka Romantic Getaway",Jun 1 - 6,335.00,,4.97 (179),1 queen bed
"Apartment in La Habana, Cuba",Old Havana+Cuban Style Place+Roof Top+WiFi,Jun 4 - 9,57.00,,4.48 (161),1 king bed
"Home in Vero Beach, Florida, US","Heated Pool, Putt Putt Golf",Jun 11 - 16,468.00,,4.93 (15),5 beds
"Room in Cuauhtémoc, , Mexico",Guest Suite in Historic Architecture Home,Jun 16 - 23,55.00,,4.82 (443),2 queen beds
"Condo in Kaunakakai, Hawaii, US",$87 a night Molokai Escape Condo,Jun 29 - Jul 6,101.00,,4.76 (337),1 double bed
"Treehouse in Atenas, Costa Rica",Treehouse on a Coffee Farm with Ocean View,Jun 25 - Jul 2,74.00,,5.0 (13),1 king bed
"Apartment in Tulum, Mexico",Design Casa Patchouli with private pool and lounge,Jun 21 - 26,283.00,,4.98 (80),1 double bed
"Shipping container in Jauca, Puerto Rico",Pequeño espacio Romántico piscina y muelle privado,Jul 17 - 22,220.00,,4.95 (139),1 bed
"Tiny home in Peachland, Canada",Haven in the Woods- tiny home WiFi & solar power,Jun 11 - 16,76.00,,5.0 (4),1 king bed
"Shipping container in Puerto Viejo de Talamanca, Costa Rica",Mimosa Y - Beautiful Unique Container Home w' Pool,Jun 3 - 8,90.00,,4.85 (54),1 king bed
"Shipping container in Puerto Viejo de Talamanca, Costa Rica",Mimosa Y - Beautiful Unique Container Home w' Pool,Jun 3 - 8,90.00,522.00,4.85 (54),1 king bed
"Apartment in Acapulco, Mexico",COMFORTABLE BEACH DEPA OVERLOOKING THE SEA,Jun 4 - 9,42.00,96.00,4.57 (226),1 bed
"Yurt in Airville, Pennsylvania, US",Waterfront Glamping Muddy Creek PA,Jun 4 - 10,102.00,,4.95 (22),1 king bed
"Boutique hotel in San Juan, Puerto Rico",2 Pools on property | Walk to the beach | Rosalina Ocean Park | Luxury Suite 3,Jul 27 - Aug 2,164.00,,4.81 (212),2 queen beds
"Room in Acapulco, Mexico",Love nest when singing of the Sea!,Jun 6 - 11,41.00,,4.68 (266),9 beds
"Home in Pinilla, Costa Rica",Casa La Paz vistas al mar @ Pinilla Highlands,Jul 30 - Aug 6,146.00,,4.86 (7),1 bed
"Farm stay in Siler City, North Carolina, US",Lovely farm cabin experience,Jun 11 - 16,114.00,,5.0 (5),2 beds
"Tiny home in Horning's Mills, Canada",Pine River Bunkies: Heron’s Landing Off Grid Cabin,Jun 1 - 6,120.00,,4.89 (103),2 beds
"Camper/RV in Ashford, Washington, US",The Alpine Airstream at Mt. Rainier with Hot Tub,Jun 11 - 16,286.00,,5.0 (11),1 queen bed
"Bungalow in Newport Beach, California, US","Surf, Sand & Sunsets - Goldenrod CdM BEACH STUDIO",Jul 31 - Aug 7,229.00,,4.8 (289),3 beds
"Hut in Guarne, Colombia",Refugio LOS PAPIROS,Jun 4 - 9,18.00,,4.89 (66),3 beds
"Room in Acapulco, Mexico",Beach crab.,Jun 1 - 6,43.00,,4.74 (270),3 beds
"Cabin in Fennville, Michigan, US",Fire & Water | Rejuvenating Stay on the Riverbend,Jun 4 - 9,743.00,,4.83 (175),1 double bed
"Home in Tamanique, El Salvador",Black rose -Right house-,Jun 11 - 16,243.00,,4.63 (275),1 queen bed
"Nature lodge in Las Galeras, Dominican Republic","Casa El Paraiso, Las Galeras (room #5)",Jun 10 - 15,286.00,,4.94 (270),3 beds
"Room in Monteverde, Costa Rica",Holistic House Diamond,Jun 5 - 11,160.00,,4.96 (274),3 beds
"Tiny home in Malibu, California, US","Malibu Serene Guest House, Mins to Beach & Hike",Jun 25 - 30,252.00,,4.77 (298),3 beds
"Apartment in Cancún, Mexico",Free Transportation / Premium Beach Loft 1711th,Jun 1 - 6,138.00,,5.0 (15),3 beds
"Cabin in Gilmour, Canada",Cozy cabin on 5 acres !,Jun 4 - 9,86.00,114.00,4.73 (124),2 beds
"Condo in Ocean City, Maryland, US",OceanfrontStudio-Slps4-Pool-Pickleball-HBOMax-Dis+,Jun 9 - 16,291.00,191.00,4.94 (80),2 beds
"Apartment in Cancún, Mexico",Amazing Ocean Front II,Jul 9 - 14,45.00,41.00,4.88 (306),1 queen bed
"Condo in Rosarito, Mexico",LUXE & STYLISH/3BR/LAS OLAS CONDO/12TH FLR/ROSARITO,Jun 11 - 16,173.00,138.00,4.8 (207),4 beds
"Room in New York, New York, US","Lovely Private Room-Manhattan, 70s-Upper East Side",Jul 9 - 14,103.00,89.00,4.93 (30),1 bed
"Cottage in Islamorada, Florida, US",1 BD PRIVATE HOUSEBOAT/ COTTAGE TARPON,Aug 6 - 11,229.00,,4.85 (74),1 queen bed
"Apartment in Gordonville, Pennsylvania, US",“What a wonderful world” - Modern Farmhouse,Jun 4 - 9,165.00,,4.87 (478),1 queen bed
"Cottage in Quintana Roo, Mexico",Glass Roof House #2 at Glass 20.87,Jun 10 - 15,221.00,,4.93 (68),2 queen beds
"Cabin in Georgetown, Maine, US","Modern Cabin On Pond, AC & Porch",Jun 2 - 7,231.00,,New,1 king bed
"Apartment in Marina del Rey, California, US",Romantic Ocean Penthouse w/ panoramic marina views,Jun 1 - 8,247.00,,4.77 (111),1 bed
"Hotel in Tepoztlán, Mexico",Posada Sarita,Jun 3 - 10,50.00,,4.56 (176),3 beds
"Cottage in Oceanside, California, US","Beach Bungalow on the Sand, Steps to the Ocean",Jun 3 - 8,483.00,,4.93 (213),2 beds
"Apartment in Los Angeles, California, US",Historic Venice Apt 1/2 blocks to beach+parking,Nov 16 - 21,185.00,,4.94 (431),2 beds
"Home in Cape Coral, Florida, US",Amazing Modern Home with Pool and Hot Tub!,Jul 11 - 16,167.00,,4.84 (136),2 beds
"Condo in Malibu, California, US","Malibu, Carbon Beach - Suite Three",Jun 4 - 9,649.00,,4.8 (425),3 beds
"Farm stay in Saint Marys, Canada",Cozy Farm Stay Getaway,Jun 11 - 16,99.00,,4.86 (183),2 queen beds
"Tiny home in Mill Village, Canada",UpStream (Waterfront Cabin With Wood Stove & WiFi),Jun 25 - 30,97.00,,4.87 (101),1 bed
"Place to stay in Tepoztlán, Mexico",M6. Alojamiento ideal para explorar Tepoztlán,Jun 25 - Jul 1,40.00,,4.86 (28),1 bed
"Cabin in Mineral Bluff, Georgia, US",Scenic Solitude-Amazing Mountain views on 5 acres,Jun 4 - 9,302.00,175.00,5.0 (44),2 beds
"Room in New York, New York, US","Lovely Private Room-Manhattan, 70s-Upper East Side",Jul 9 - 14,103.00,114.00,4.93 (30),1 bed
"Cottage in Islamorada, Florida, US",1 BD PRIVATE HOUSEBOAT/ COTTAGE TARPON,Aug 6 - 11,229.00,191.00,4.85 (74),1 queen bed
"Apartment in Gordonville, Pennsylvania, US",“What a wonderful world” - Modern Farmhouse,Jun 4 - 9,165.00,41.00,4.87 (478),1 queen bed
"Cottage in Quintana Roo, Mexico",Glass Roof House #2 at Glass 20.87,Jun 10 - 15,221.00,138.00,4.93 (68),1 queen bed
"Condo in Luquillo, Puerto Rico",“Playa Luna”- Breathtaking Ocean and City Views,Jul 2 - 7,138.00,89.00,4.88 (159),1 bed
"Room in Malibu, California, US","Peace, Beauty & Ocean View, Malibu",Sep 12 - 17,189.00,165.00,4.95 (1014),1 king bed
"Treehouse in Sundridge, Canada",Lount Treetop Rentals - Unit 2,Jun 1 - 6,135.00,48.00,4.97 (173),1 bed
"Apartment in Marina del Rey, California, US",Romantic Ocean Penthouse w/ panoramic marina views,Jun 1 - 8,247.00,,4.77 (111),2 beds
"Hotel in Tepoztlán, Mexico",Posada Sarita,Jun 3 - 10,50.00,,4.56 (176),3 beds
"Home in Cape Coral, Florida, US",Amazing Modern Home with Pool and Hot Tub!,Jul 11 - 16,167.00,,4.84 (136),1 queen bed
"Farm stay in Saint Marys, Canada",Cozy Farm Stay Getaway,Jun 11 - 16,99.00,,4.86 (183),2 double beds
"Apartment in Galveston, Texas, US",Beach Front Condo In Casa Del Mar,Jun 18 - 24,205.00,,4.72 (389),2 beds
"Apartment in Laguna Beach, California, US",Laguna Beach Studio Oceanviews 49,Jun 1 - 6,148.00,,4.36 (273),2 beds
"Apartment in Punta Cana, Dominican Republic",Charming Beach Condo in Bavaro Top Location,Jun 3 - 8,57.00,,4.76 (200),1 queen bed
"Cabin in Woodford, Vermont, US",400+ Airbnb Visits: Incredible Mountain Cabin,Jun 4 - 9,137.00,,4.85 (325),2 double beds
"Cabin in Bowen Island, Canada",the legendary wildwood cabins ~ CABIN 2,Sep 24 - 29,126.00,,4.99 (742),2 double beds
"Hotel room in Laguna Beach, California, US",Oceanfront Laguna Beach Amazing Views 28,Jun 4 - 9,276.00,,4.63 (390),2 double beds
"Place to stay in Hopatcong, New Jersey, US",Lake Sports Home & Super water sports!,Aug 20 - 25,154.00,233.00,5.0 (18),3 beds
"Guesthouse in Naples, Florida, US",Waterfront Sea Cottage,Jun 13 - 18,82.00,,4.8 (276),1 queen bed
"Cabin in Reaboro, Canada",Cedar Springs Cabin - A Cozy Hideaway in the Woods,Jun 16 - 21,346.00,,4.97 (76),2 beds
"Apartment in San José del Cabo, Mexico",Beachfront at its finest @ San Jose del Cabo! 🤩🏄🏼‍♂️🏖,Jun 22 - 29,78.00,,4.75 (186),1 bed
"Cabin in Puerto Viejo de Talamanca, Costa Rica",Tiny Beach front house,Jul 24 - 29,89.00,,4.73 (140),2 beds
"Tiny home in Tremont, Maine, US",Coyote's Den at The Howling Woods,Jun 28 - Jul 3,123.00,,4.87 (303),2 single beds
"Home in Manzanita, Oregon, US","Near Ocean, BBQ, Dog OK, Cute Manzanita Beach",Jun 1 - 6,147.00,,New,2 queen beds
"Home in Hamilton, Canada",Stunning house on lake Ontario,Jun 25 - 30,210.00,,4.9 (192),2 beds
"Tiny home in Key Largo, Florida, US","Oceanfront Lookout Point w/two Kayaks,Beach & Dock",Aug 12 - 17,254.00,,4.86 (90),1 queen bed
"Hotel in Willemstad, Curaçao",Saint Tropez Boutique Hotel,Jun 22 - 27,125.00,,4.78 (74),1 king bed
"Cabin in Bowen Island, Canada",the legendary wildwood cabins ~ CABIN 4,Jul 8 - 13,173.00,,4.98 (678),1 queen bed
"Room in Key West, Florida, US",1-Private room/bbq/patio. 2 full bed 1 couch bed.,Jul 29 - Aug 3,258.00,,4.83 (40),2 beds
"Condo in East End, U.S. Virgin Islands",Beautiful corner unit condo right on the beach!,Jun 3 - 8,298.00,,4.97 (73),2 sofa beds
"Boat in Stuart, Florida, US",House Boat Sunset Bay Marina Stuart Fl,Sep 10 - 15,127.00,,4.92 (279),2 beds
"Apartment in Guanacaste Province, Costa Rica",Surf Shack Guiones - perfect beach location,Jun 17 - 24,130.00,,4.82 (278),2 beds
"Hut in Balderson, Canada",Glamping Cabin at Balderson Blueberries,Jun 11 - 16,80.00,,4.89 (76),1 queen bed
"Tiny home in Aptos, California, US",Bamboo Cottage in Aptos Mountain Retreat & Spa,Jul 16 - 21,130.00,,4.78 (257),1 queen bed
"Guesthouse in Naalehu, Hawaii, US",The Ohana,Jun 23 - 28,99.00,,4.86 (182),1 queen bed
"Condo in Honolulu, Hawaii, US",23FL Skyline King Studio w/Ocean & City Views.,Jun 12 - 18,221.00,174.00,4.95 (41),2 beds
"Boutique hotel in Miami Beach, Florida, US",Room 2 Queen beds- Buffet Breakfast-Steps to beach,Jun 5 - 10,116.00,139.00,4.38 (156),2 beds
"Condo in Miami, Florida, US","Luxury Condo in Hotel, amenities Downtown/Brickell",Jun 11 - 16,219.00,61.00,4.94 (72),2 sofa beds
