Title,Detail,Date,Price(in dollar),Offer price(in dollar),Review and rating,Number of bed
"Apartment in Muang Pattaya, Thailand",#18 2022 Newest! Downtown Lux Fun Sea View Condo,Jun 1 - 6,63.00,,5.0 (27),1 queen bed
"Cabin in Lazi, Philippines",Enchanted River cabin w/private garden and kitchen,Aug 19 - 24,51.00,,4.85 (127),1 queen bed
"Condo in Cebu City, Philippines",Cozy City Condo at Horizons 101 [ W/ WIFI ].,Jun 5 - 10,26.00,,4.44 (220),2 beds
"Apartment in Tambon Patong, Thailand",SUNSET SEAVIEW DELUXE PATONG - POOL+TERRACE,Jun 25 - 30,64.00,,4.8 (159),2 beds
"Condo in Chiang Mai, Thailand",Cozy room 48.5 sq.m @The Astra near Night market,Jun 7 - 12,45.00,,4.89 (190),2 beds
"Condo in Melaka, Malaysia",B2733/Seaview/5mins to Jonker/Imperio/Studio/4pax,Jun 4 - 10,30.00,,4.71 (230),3 beds
"Condo in Cyberjaya, Malaysia",Kanvas Soho / KLIA / FREE WIFI 500mbps,Jun 4 - 9,24.00,,4.8 (410),2 beds
"Loft in Jelutong, Malaysia",#Maritime*3*The Rhythm of the Sea @ 日出无敌全海景,Jun 30 - Jul 5,98.00,,4.56 (93),3 double beds
"Villa in Phuket, Thailand",Waterfront Traditional Thai Style Pool Villa (V7),Jun 1 - 6,41.00,,4.71 (82),1 queen bed
"Room in Tebet, Indonesia",The LOJI @ Patra Kuningan # 3,Jun 30 - Jul 5,24.00,,4.83 (69),2 double beds
"Villa in Pemuteran, Indonesia","Villa Arun, Sumberkima Hill",Aug 21 - 26,262.00,,4.88 (57),1 queen bed
"Apartment in Quận 4, Vietnam",DANNY’s HIGH VIEW STUDIO near District1 Ben Thanh!,Jun 3 - 8,44.00,,4.78 (167),1 queen bed
"Apartment in Pasay, Philippines",Comfy-Cozy-Cheap @ NAIA 3 near RW w/ NETFLIX,Jul 25 - 30,33.00,573.00,4.86 (692),3 beds
"Condo in Manila, Philippines",[50mbps+NETFLIX] Your home in the heart of Manila,Jun 1 - 6,28.00,38.00,4.73 (159),1 double bed
"Room in Khet Din Daeng, Thailand",Comfy Room with Bathroom near MRT Phra Ram 9,Aug 14 - 19,30.00,63.00,4.99 (72),1 king bed
"Apartment in Patong, Thailand","Endless Patong Ocean View from a Hilltop Condominium, Phuket",Jun 1 - 8,56.00,100.00,4.95 (252),4 beds
"Villa in Uluwatu, Indonesia","Spectacular Ocean View Villa in Uluwatu, Bali",Jun 14 - 19,673.00,,4.94 (143),2 beds
"Room in Kecamatan Ubud, Indonesia","Exclusive Villa, for Couples Looking To Relax",Sep 4 - 9,149.00,,4.85 (62),2 king beds
"Apartment in Tambon Patong, Thailand",1 BR Phuket Modern Luxury Living,Jun 6 - 11,44.00,,4.68 (202),1 king bed
"Apartment in Shah Alam, Malaysia",*SETIA ALAM* Big Luxury Comfort Homestay #Trefoil,Jun 7 - 12,30.00,,4.87 (171),1 king bed
"Room in Ubud, Indonesia",Luxury Villa in Ubud,Jun 10 - 15,65.00,,4.91 (54),3 beds
"Resort in Langkawi, Malaysia","S101 Beachfront Private Villa,
A Resort by the Sea",Jun 4 - 9,49.00,,4.75 (80),2 queen beds
"Apartment in Kuala Lumpur, Malaysia",Admire Deluxe Marble Walls at a Highrise Resort Home,Jun 2 - 7,85.00,,4.85 (135),2 beds
"Condo in Melaka, Malaysia",B1706/5 mins drive to Jonker/Imperio/Studio/4pax,Jun 1 - 7,29.00,,4.79 (195),1 bed
"Room in Kecamatan Ubud, Indonesia",Odesa Villa1 Ubud close to center,Jun 11 - 16,29.00,,5.0 (9),1 bed
"Hotel room in Ubud, Indonesia","Malay villa, Best views in Ubud!",Jun 8 - 13,167.00,,4.77 (119),1 bed
"Room in Khlong Ton Sai, Khlong San, Thailand",*Hidden Oasis Bangkok 1 | Near ICONSIAM,Jul 2 - 7,28.00,,4.86 (166),1 bed
"Home in Tambon Bo Put, Thailand",Directly on the beach-for animal lovers only,Jun 1 - 6,144.00,,5.0 (27),1 bed
"Place to stay in Kamala, Thailand","Maphrao in Kamala, accommodation on the beach",Jun 3 - 10,49.00,,4.89 (37),1 bed
"Room in El Nido, Philippines",A Divers Home: beachfront room with sunset view,Jun 26 - Jul 2,34.00,,4.89 (98),1 bed
Tiny home in Millersburg,Forest Haven - Otium,May 1 - 6,224.00,,4.85 (218),1 queen bed
Treehouse in Crane Hill,WANDERLUST TREEHOUSE Book an experience!,May 1 - 6,402.00,,4.99 (271),1 queen bed
Home in Telluride,Architectural Masterpiece | Best View in Telluride,May 1 - 6,732.00,,4.97 (76),5 beds
Cabin in West Farmington,The Triangle: A-Frame Cabin for your city retreat,May 1 - 6,123.00,,4.91 (515),4 beds
Cabin in Crosby,Cozy Louise Cabin - Direct Cuyuna MTB Access/Sauna,May 1 - 6,225.00,,5.0 (18),2 queen beds
Cabin in Hancock,A-frame cabin by the bay with kayak!,May 1 - 6,230.00,,4.88 (128),2 queen beds
Tiny home in Sandy Valley,Peacock Tiny House near Las Vegas,May 1 - 6,155.00,,4.92 (744),2 beds
Cabin in Fredericksburg,Peach Log Cabin/Hot Tub/Romantic/Close to Town!,May 1 - 6,292.00,,4.97 (244),1 queen bed
Room in New York,Guest room available short stays,May 1 - 6,217.00,,5.0 (4),2 queen beds
Cabin in Fredonia,"Tiny House Cozy Cabin by Zion, Grand Canyon, Bryce",May 1 - 6,188.00,,5.0 (611),4 beds
Treehouse in Dahlonega,Nature’s Nook- A Modern Treehouse Near Wineries,May 1 - 6,336.00,,4.94 (163),3 beds
Farm stay in Sandy Valley,Conestoga Wagon on Dude Ranch NEAR LAS VEGAS,May 1 - 6,147.00,,4.86 (196),1 bed
Treehouse in Travelers Rest,The Forestry House - A modern luxury treehouse.,May 1 - 6,305.00,,New,1 queen bed
Treehouse in Fernwood,Crystal Peak Lookout 🌲,May 5 - 10,230.00,,4.88 (470),3 beds
Cabin in Packwood,Heartwood Cabin at Mt. Rainier,May 1 - 6,354.00,,4.98 (246),3 beds
Cabin in Nashville,Modern Nashville Home in the Woods,May 5 - 10,278.00,,4.99 (290),1 king bed
Treehouse in Fredericksburg,The Leaf Treehouse,May 1 - 6,641.00,,4.99 (339),2 beds
Cabin in Bryson City,Secluded View! A-Frame Hot Tub and Fire Pit,May 1 - 6,361.00,,4.95 (20),2 beds
Cabin in Branson,Lakefront A-Frame Cabin on Table Rock Lake,May 1 - 6,129.00,,4.86 (22),2 beds
Home in Livingston,The Cargill-Earl Guesthouse at Erik's Ranch,May 1 - 6,426.00,,4.88 (323),3 beds
Home in Taos,Taos Mesa Studio Earthship,May 1 - 6,194.00,,4.91 (781),1 queen bed
Place to stay in Shippensburg,A- Frame Cabin,May 1 - 6,273.00,,5.0 (168),2 queen beds
Home in Scottsdale,Diamond Desert Escape,May 3 - 8,384.00,,4.97 (34),5 beds
Cabin in Ronan,Calowahcan Cabin *NEW hot tub*,May 1 - 6,213.00,,5.0 (401),3 queen beds
Home in Fairlee,Cozy Bow House Perched in Trees w/ Hot Tub & View,May 1 - 6,244.00,,4.95 (344),5 beds
Yurt in Rising Fawn,Cherry Blossom Yurt on Lookout Mountain,May 1 - 6,157.00,,4.97 (666),1 king bed
Cabin in Boone,Storybook A-Frame Cabin in the Woods Close to Downtown Boone,May 1 - 6,218.00,,4.99 (372),2 queen beds
Cabin in Urbana,The Cabin at Maple View - Accepting Reservations,May 1 - 6,123.00,,4.99 (599),2 beds
Cabin in Martin City,Romantic Cabin - 9 miles to Glacier National Park,May 1 - 6,171.00,,4.91 (237),2 beds
Home in Austin,Enjoy the Heated Pool at a Beautifully Designed Getaway,May 1 - 6,213.00,,4.96 (853),1 king bed
Cabin in Livingston,10-Acre Yellowstone Cabin w/Stunning Mtn View,May 1 - 6,222.00,,4.93 (101),4 beds
Condo in Avalon,"The Big Blue, 1 BR+Den!",May 1 - 6,597.00,,4.79 (539),2 beds
Tent in Moab,Moab Glamping Luxury Tent for 2,May 1 - 6,254.00,,4.92 (279),1 queen bed
Home in Destin,Villa Loggia! 5min walk to Prvt Beach/pool/SmartTV,May 6 - 11,417.00,,4.94 (34),6 beds
Cabin in Crivitz,"Scenic, Serene Lakefront Cabin — Wood Stove",May 1 - 6,149.00,,4.99 (72),3 beds
Tiny home in Lakeside,The Stillwater at Stoner Creek Cabins,May 1 - 6,178.00,,5.0 (211),1 bed
Home in Half Moon Bay,A little piece of heaven...,May 1 - 6,950.00,,4.88 (180),4 beds
Cabin in Martin City,Romantic Cabin - 9 miles to Glacier National Park,May 1 - 6,171.00,,4.91 (237),2 beds
Home in Austin,Enjoy the Heated Pool at a Beautifully Designed Getaway,May 1 - 6,213.00,,4.96 (853),1 king bed
Condo in Avalon,"The Big Blue, 1 BR+Den!",May 1 - 6,597.00,,4.79 (539),2 beds
Home in Henderson,Beautiful pool home near strip,May 1 - 6,252.00,,5.0 (15),3 beds
Tent in Moab,Moab Glamping Luxury Tent for 2,May 1 - 6,254.00,,4.92 (279),1 queen bed
Home in Destin,Villa Loggia! 5min walk to Prvt Beach/pool/SmartTV,May 6 - 11,417.00,,4.94 (34),6 beds
Tiny home in Lakeside,The Stillwater at Stoner Creek Cabins,May 1 - 6,178.00,,5.0 (211),1 bed
Condo in Orange Beach,Totally Beachin - Condo with Stunning Ocean Views,May 1 - 6,287.00,,4.69 (75),6 beds
Cabin in Clyde,Moonlit Chalet,May 1 - 6,175.00,,4.87 (173),2 beds
Home in Wilmington,Atlantic Coast Dome Home Across from Sound w/ View,May 19 - 24,244.00,,4.96 (47),2 beds
Home in Cape Coral,Welcome to our Modern Cape Escape with Heated Pool,May 1 - 6,233.00,,4.96 (28),5 beds
Vacation home in Klamath Falls,The 'Easy A' Cabin in Rocky Point,May 1 - 6,202.00,,4.82 (82),3 beds
Condo in Daytona Beach,Luxury One Bedroom Condo with private balcony,May 1 - 6,123.00,,4.9 (106),3 beds
Home in St. Augustine,"""Swan Ocean"" Beach House on Vilano Beach",May 1 - 6,955.00,,4.88 (60),6 beds
Condo in New Smyrna Beach,Coastal Waters 214-2nd floor ocean view condo,May 1 - 6,168.00,,4.47 (43),2 beds
Home in Eustis,Lake House Minutes to Downtown Mt. Dora and Eustis,May 1 - 6,173.00,,4.99 (179),2 beds
Tiny home in White Pigeon,Circle J Bed & Breakfast,May 1 - 6,92.00,,4.97 (528),2 beds
Cabin in Cripple Creek,"Hillside Cripple Creek Cabin w/Hot Tub, Mtn Views!",May 1 - 6,196.00,,4.93 (72),3 beds
Cabin in Moab,Basic Cabin #1 - Sleeps 4 - OK-C1,May 6 - 11,125.00,,4.86 (233),3 beds
Home in Petersburg,ONLY 1.5 Miles from the Creation Museum!,May 1 - 6,124.00,,4.89 (170),4 beds
Home in Twentynine Palms,"Blue Oasis | King Bed | Feel Far, Be Close Dogs ok",May 1 - 6,155.00,,4.94 (258),2 beds
Room in McKinney,Garden Gate Getaway,May 1 - 6,53.00,,4.88 (110),2 beds
Home in El Prado,Taos Skybox "Stargazer" High Desert Retreat,May 1 - 6,184.00,,4.93 (61),1 bed
Treehouse in Sevierville,"The best in tiny living!
TreehouseTopia",May 1 - 6,229.00,,4.87 (193),2 queen beds
Home in Fort Myers,*Unique Pyramid Home for an amazing vacation,May 1 - 6,231.00,,4.93 (165),1 queen bed
Cottage in Los Angeles,Private Modern Guesthouse near Mulholland Drive,May 1 - 6,151.00,,4.93 (555),2 beds
Home in Summertown,Water side Cozy cabin,May 1 - 6,98.00,,4.91 (318),4 beds
Cabin in Florissant,NEW! One-of-a-Kind Luxury Cabin w/Hot Tub,May 1 - 6,358.00,,5.0 (49),1 queen bed
Guesthouse in Escondido,Hilltop cabin retreat with lake & mountain views,May 1 - 6,188.00,,4.93 (551),5 beds
Townhouse in Kissimmee,Brand New 3 beds at Solara Resort,May 1 - 6,155.00,,4.83 (12),2 beds
Cabin in Gold Bar,New lux cabin w/mount index view,May 1 - 6,276.00,,4.86 (7),1 bed
Treehouse in Watsonville,Redwood Treehouse Santa Cruz Mtns.,May 5 - 10,190.00,,4.89 (932),2 beds
Condo in Kissimmee,Mickey Mouse Themed Getaway next to Disney 1,May 1 - 6,115.00,,4.84 (295),4 beds
Home in Ellington,Crystal Lake House,May 1 - 6,155.00,,5.0 (9),4 beds
Home in Orlando,The Orlando Retreat.,May 1 - 6,230.00,,4.95 (78),4 beds
Farm stay in Lebec,The Alpaca (A Lone Juniper Ranch Cabin),May 1 - 6,124.00,113.00,4.92 (381),2 queen beds
Cabin in Newry,Cozy Cabin on Sunday River ~,May 1 - 6,202.00,,4.93 (41),2 beds
Tiny home in Greer,*BRAND NEW* Tiny Village Retreat,May 1 - 6,90.00,,5.0 (86),2 beds
Cabin in Pine Ridge,Cliffside Romantic Retreat LOVE,May 1 - 6,321.00,,5.0 (25),1 king bed
Tiny home in Greer,Modern Cabin Tiny Retreat,May 1 - 6,90.00,,4.98 (558),3 beds
Cabin in Groton,Peaceful Log Cabin in the Woods,May 3 - 8,122.00,,4.99 (497),2 double beds
Cabin in Ellijay,Cozy Creek Cabin-couples retreat nestled in woods,May 1 - 6,184.00,,4.98 (208),1 king bed
Apartment in Orlando,Cozy Studio close to Universal,May 1 - 6,82.00,,4.2 (148),2 beds
Cabin in Blue Ridge,Beaver Bungalow - Long Range Mountain Views,May 1 - 6,163.00,,4.96 (77),2 beds
Condo in Destin,"Sea Squirrel, Beach views in Crystal Beach",May 1 - 6,246.00,,4.78 (9),1 bed
Tiny home in Hillsboro,Out of Bounds: Tiny Cabin amongst acres of trees,May 1 - 6,170.00,,4.95 (277),2 queen beds
Apartment in Orlando,Newly remodeled! Condo in Center of All The Action,May 1 - 6,100.00,,4.49 (372),2 beds
Tiny home in Cortez,Canyon Hideout Bungalow,May 1 - 6,179.00,,5.0 (341),1 queen bed
Place to stay in Wapwallopen,"Peaceful, authentic, rustic log cabin in the woods",May 4 - 9,132.00,,4.98 (106),2 beds
Cottage in Crozet,Idyllic Cottage Retreat,May 1 - 6,188.00,,4.86 (14),2 beds
Cabin in Leicester,Cabin Kisa,May 1 - 6,106.00,,5.0 (7),1 bed
Cabin in Robbinsville,Mountain Dream gorgeous view with hot tub,May 1 - 6,190.00,,4.96 (591),2 queen beds
Apartment in Kissimmee,Special Offer Storey Lake 2Bedr 2Bath Free Waterpark BE307,May 1 - 6,134.00,,4.79 (73),4 beds
Cabin in Leicester,Cabin Kisa,May 1 - 6,106.00,610.00,5.0 (7),1 bed
Cabin in Robbinsville,Mountain Dream gorgeous view with hot tub,May 1 - 6,190.00,338.00,4.96 (591),2 queen beds
Apartment in Kissimmee,Special Offer Storey Lake 2Bedr 2Bath Free Waterpark BE307,May 1 - 6,134.00,120.00,4.79 (73),4 beds
Cabin in Lancing,Creekside Cabin at Shady Grove Farm,May 1 - 6,90.00,135.00,4.97 (476),2 beds
Villa in Las Vegas,"Vegas Villa-Heated Pool, Indoor Jacuzzi, Billiards",May 1 - 6,668.00,218.00,4.93 (27),9 beds
Villa in Miramar,Modern Retreat with King Bed-Heated Pool-and Grill,May 1 - 6,494.00,,5.0 (33),6 beds
Apartment in Santa Monica,Venice Canals Sanctuary,May 1 - 6,374.00,,4.93 (107),2 beds
Cabin in Sevierville,Sugar Bear Hollow,May 1 - 6,219.00,,4.96 (91),3 beds
Guesthouse in Phoenix,Studio B,May 1 - 6,111.00,,4.95 (819),2 queen beds
Tiny home in Desert Hot Springs,Rock Reign Ranch,May 1 - 6,132.00,,4.92 (12),1 queen bed
Guest suite in Sedona,"Sedona Sunset Jewel, Amazing Views, Pool",May 1 - 6,209.00,,5.0 (516),1 king bed
Condo in Kissimmee,10 mins to Disney-Hot tub-Queen Puffy Lux bed,May 2 - 7,213.00,,4.82 (74),3 beds
Apartment in Fernandina Beach,Largest 1 Bed 2 bath in Amelia Surf & Racquet Club,May 1 - 6,306.00,,New,2 beds
Condo in Panama City Beach,300 STEPS TO THE BEACH-BEST 1 BEDROOM DEAL IN TOWN,May 1 - 6,169.00,,4.68 (57),2 beds
Room in New York,Private room(s) in a Renovated Manhattan Townhouse,May 1 - 6,259.00,,4.94 (16),2 beds
Condo in Miami,Luxurious brickell apartment 38thfloor ocean view,May 1 - 6,239.00,,4.69 (51),2 beds
Loft in Chicago,"Lakeview Loft-Vintage Chicago, Modern Amenities",May 1 - 6,126.00,,4.96 (343),3 beds
Cottage in Kissimmee,"JU Super Duper Tiny House, 15 minutes to Disney",May 1 - 6,98.00,,4.95 (400),3 beds
Apartment in Orlando,Excellent suite to enjoy near Disney.,May 1 - 6,90.00,218.00,4.71 (241),2 beds
Condo in Panama City Beach,300 STEPS TO THE BEACH-BEST 1 BEDROOM DEAL IN TOWN,May 1 - 6,169.00,,4.68 (57),2 beds
Room in New York,Private room(s) in a Renovated Manhattan Townhouse,May 1 - 6,259.00,,4.94 (16),2 beds
Condo in Miami,Luxurious brickell apartment 38thfloor ocean view,May 1 - 6,239.00,,4.69 (51),2 beds
Loft in Chicago,"Lakeview Loft-Vintage Chicago, Modern Amenities",May 1 - 6,126.00,,4.96 (343),3 beds
Cottage in Kissimmee,"JU Super Duper Tiny House, 15 minutes to Disney",May 1 - 6,98.00,,4.95 (400),4 beds
Home in DeFuniak Springs,On Juniper Lake w/Boat Dock Near 30A!,May 1 - 6,113.00,,4.79 (19),4 beds
Condo in Hilton Head Island,Ocean Front Resort - King bed,May 1 - 6,184.00,,4.93 (304),1 queen bed
Cabin in Forks,Cozy riverside/rain forest cabin ~ Bogie Bungalow,May 3 - 8,143.00,,4.96 (949),2 queen beds
Condo in Fort Walton Beach,Ft Walton cozy condo w/ on-site pool. Near beaches,May 1 - 6,145.00,,4.73 (249),3 beds
Apartment in Sarasota,Private Bay area home !,May 1 - 6,117.00,,4.67 (3),3 beds
Cabin in Kanab,Altitude Adjustment,May 10 - 15,208.00,,4.98 (161),4 beds
Room in Los Angeles,Private Room in Elegant French Gothic Home,May 1 - 6,114.00,,4.87 (843),2 queen beds
Room in Carlisle,Stuart Manor Bed and Breakfast,May 1 - 6,223.00,,5.0 (26),2 beds
Condo in Pensacola,The Beach Couldn't Be Any Closer!,May 1 - 6,260.00,,4.9 (145),6 beds
Apartment in Richmond,Point Richmond Top Floor Studio with Bay views,May 1 - 6,153.00,,4.95 (128),6 beds
Guest suite in Trinidad,Cottage by the Sea,May 1 - 6,138.00,,4.92 (554),6 beds
Home in Kissimmee,House by the Mouse: Something for Everyone!,May 19 - 24,250.00,,4.89 (157),6 beds
Apartment in Houston,King Suite/Sky Lounge/Luxurious Experience.,May 1 - 6,108.00,148.00,4.85 (55),2 beds
Cabin in Sevierville,Few days left in May,May 1 - 6,286.00,112.00,4.98 (263),1 king bed
Cabin in Fountain Green,"Cozy Private Mountain Cabin on 1,000 acre property",May 1 - 6,186.00,103.00,4.96 (78),4 beds
Room in New York,"Lovely Private Room-Manhattan, 70s-Upper East Side",May 1 - 6,199.00,,4.93 (30),1 bed
Cottage in Islamorada,1 BD PRIVATE HOUSEBOAT/ COTTAGE TARPON,May 1 - 6,229.00,,4.85 (74),3 beds
Home in Michigan City,Sugar Babe Beach Retreat with Hot Tub!,May 1 - 6,160.00,,4.95 (328),2 queen beds
Hotel in Kissimmee,Modern room in boutique hotel near amusement parks,May 1 - 6,64.00,,4.81 (54),2 beds
Condo in Mary Esther,"Kayaks adventure, Dock, Pool, WiFi Courtyard view.",May 1 - 6,112.00,,4.72 (94),2 beds
Apartment in Los Angeles,Historic Venice Apt 1/2 blocks to beach+parking,May 1 - 6,222.00,,4.94 (431),2 beds
Guesthouse in Greensboro,A charmer!Great spot near downtown.,May 1 - 6,81.00,,4.97 (990),3 beds
Apartment in Hallandale Beach,Beachfront Apartment,May 1 - 6,170.00,,4.43 (23),1 queen bed
Apartment in Galveston,Beach Front Condo In Casa Del Mar,May 1 - 6,122.00,,4.72 (389),2 beds
Guesthouse in Carrollton,The Cooper Cottage | Guesthouse,May 1 - 6,91.00,,5.0 (5),4 beds
Cabin in Wofford Heights,Tillie Creek Retreat: a Creekside Oasis,May 1 - 6,145.00,,4.85 (312),3 beds
Home in Phoenix,New* Desert Moon* HeartofPhoenix,May 1 - 6,112.00,,4.78 (9),3 queen beds
Cottage in Mackinaw City,Private Mackinaw City Beach Cottage ~ Bridge view,May 23 - 28,355.00,,4.91 (68),1 queen bed
Guest suite in Cave Creek,Room With The Views,May 1 - 6,127.00,,4.99 (402),3 beds
Home in Venice,Venice Getaway,May 1 - 6,159.00,,5.0 (30),3 beds
Cabin in Weaverville,Reems Creek Mountain Cabin,May 9 - 14,237.00,,5.0 (222),2 queen beds
Home in Venice,Venice Getaway,May 1 - 6,159.00,,5.0 (30),3 beds
Condo in Panama City Beach,Beachfront~Amazing Views~Walkable to Walmart/Shops,May 1 - 7,184.00,,4.96 (26),4 beds
Condo in Miami,Lovely 1 bed condo with pool/wifi free parking,May 1 - 6,149.00,,4.92 (51),2 beds
Cabin in Petrolia,"The Lost Coast Tower, Petrolia",May 1 - 6,225.00,,4.92 (214),1 double bed
Apartment in New York,THE SMALL ENGLISH MANOR NESTLED AMONGST THE TREES,May 1 - 6,276.00,,4.89 (420),2 beds
Guesthouse in Los Angeles,Private Loft In the Hollywood Hills (by Universal),May 1 - 6,132.00,,4.87 (981),1 queen bed
Apartment in New York,"Location, location, location!",May 1 - 6,260.00,,5.0 (19),2 beds
Guesthouse in Dallas,Ravinia Bungalow,May 1 - 6,105.00,,4.96 (701),1 double bed
Home in Holden Beach,Egret ~ Beachfront Cottage (pet-Friendly),May 4 - 9,248.00,,4.93 (43),2 beds
Cottage in Rockaway Beach,Storybook Beach Cottage Twin Rocks,May 1 - 6,144.00,,4.88 (259),4 beds
Condo in Siesta Key,On the Beach; Siesta Key SunBum Studio,May 6 - 11,379.00,,4.96 (218),2 beds
Apartment in Laguna Beach,Laguna Beach Charming Unit- Location/Value,May 1 - 6,385.00,,4.96 (384),3 beds
Villa in Kissimmee,Windsor At Westside Avenger Newest PS5 Game room,May 11 - 16,209.00,,4.92 (12),13 beds
Home in Tucson,Central House w/ Pool & Hot Tub,May 1 - 6,142.00,,4.88 (140),2 beds
Apartment in Fort Lauderdale,Direct Ocean View from the Balcony,May 1 - 6,219.00,,4.83 (639),2 queen beds
Home in Terlingua,Terlingua Mining Ruin - Lofthouse,May 1 - 6,194.00,,4.97 (575),1 double bed
Apartment in New York,Designer Upper East side apartment Two entrances.,May 1 - 6,242.00,,4.99 (84),1 queen bed
Guesthouse in Naples,Waterfront Sea Cottage,May 1 - 6,82.00,,4.8 (276),1 queen bed
Bungalow in New Smyrna Beach,Relaxing Bungalow Steps from the Ocean,May 1 - 6,102.00,,4.86 (364),2 queen beds
Apartment in Kissimmee,Modern Great Villa near Disney & Parks,May 1 - 6,103.00,,4.87 (148),3 beds
Cottage in Kissimmee,Cozy Private Cottage 5 miles from Disney!,May 1 - 6,100.00,,4.92 (123),1 queen bed
Room in Brooklyn,"Private Studio+Bath+Balcony, 15 mins to Manhattan",May 1 - 6,144.00,,4.96 (269),1 sofa bed
Room in Los Angeles,Large Master Bedroom w Hollywood sign VIEWS,May 1 - 6,133.00,,4.9 (325),5 beds
Guest suite in Los Angeles,Echo Park Retreat with Views,May 1 - 6,116.00,,4.94 (580),4 double beds
Home in Huntington Beach,Beachfront Oasis,May 6 - 11,798.00,,4.99 (111),3 beds
Guesthouse in Colorado Springs,The Enchanted Cottage at Easy Manor,May 1 - 6,115.00,,4.96 (170),4 beds
Cabin in Hartsel,☀Sunrise Cabin☀ Balcony Mtn Views┃Grill┃Firepit,May 11 - 16,113.00,,4.98 (114),3 beds
Home in Phoenix,Cactus House - private home with pool in Phoenix,May 1 - 8,277.00,,4.99 (114),3 beds
Condo in Fort Walton Beach,"Beautiful Beachfront condo! 2 Bdrm, 2 Bath",May 1 - 6,300.00,,4.9 (104),1 bed
Room in Fairfield,"""Vacation-Sanctuary / Gateway to Napa """,May 1 - 6,114.00,,4.97 (887),1 king bed
Cabin in Kanab,Elevation Celebration,May 1 - 6,225.00,,4.97 (95),3 queen beds
Apartment in North Bay Village,Waterfront Studio Apartment with FREE Parking,May 1 - 6,160.00,,4.63 (16),2 beds
Home in Dana Point,Betty's Beach Bungalow-Pet Friendly! STR21-1232,May 1 - 6,171.00,,4.97 (478),2 beds
Home in Los Angeles,"Casual Colorful Venice House near Canals,Beach &Abbot Kinney",May 1 - 6,323.00,,4.95 (398),2 beds
Condo in Miami Beach,Beachfront Penthouse studio w/ pool on Miami Beach,May 1 - 8,181.00,,4.85 (139),2 beds
Dome in El Prado,Geodesic Earth Dome,May 1 - 6,91.00,161.00,4.9 (953),2 beds
Home in Kissimmee,7-bedroom vacation home near Disney with pool/spa,May 1 - 6,222.00,,4.83 (174),10 beds
Townhouse in Kissimmee,Beautiful 4BR Townhouse/Townhome close to Disney,May 1 - 7,132.00,,4.83 (109),5 beds
Condo in Saint Petersburg,Waterfront condo on top floor @ Boca Ciega Resort,May 1 - 6,143.00,,4.87 (360),2 beds
Townhouse in Destin,Scenic Gulf view! Steps to private beach entry!,May 1 - 6,305.00,,5.0 (41),3 beds
Condo in Fernandina Beach,"Amelia Island, 2 bedroom beach front condo",May 1 - 6,327.00,,4.92 (147),2 beds
Home in Smithville,"Fishing, Quiet & Wifi - 10 acres - Country Getaway",May 1 - 6,117.00,,4.98 (51),2 queen beds
Guesthouse in San Diego,Cozy guest studio with private deck,May 1 - 6,101.00,,4.9 (655),1 queen bed
Cottage in San Diego,Fabulous Cottage at the Beach,May 1 - 6,253.00,,4.94 (215),3 beds
Resort in Panama City Beach,Beautiful ocean front condo Panama City Beach,May 1 - 6,143.00,,4.78 (99),1 king bed
Guesthouse in Rolling Hills,"A view, a pool, and, private cabana sleeps five",May 1 - 6,165.00,,4.8 (260),4 beds
Home in Tampa,The T and C Club,May 1 - 6,247.00,,4.97 (90),6 beds
Condo in Cocoa Beach,Oceanfront Apartment - Cocoa Beach,May 1 - 6,176.00,,4.89 (53),2 beds
Apartment in Fort Lauderdale,Jr.Suite at Ocean Residences on the Beach,May 1 - 6,260.00,,4.9 (242),1 sofa bed
Cottage in San Diego,Charming Cottage at the Beach,May 11 - 16,253.00,,4.91 (550),3 beds
Condo in Fort Walton Beach,"PERFECT VIEW!! Waterfront, Marina, and 2 Pools!",May 4 - 9,99.00,,4.98 (125),2 queen beds
Condo in Las Vegas,Breath-taking Strip View on 33rd Flr Luxury Resort,May 1 - 6,118.00,,4.73 (318),2 beds
Apartment in Houston,Downtown Suite -Pool/Wi-Fi/ SkyView!,May 1 - 6,113.00,,4.84 (144),2 beds
Guest suite in Colorado Springs,Cañon Getaway- Cabin inspired home,May 1 - 6,112.00,,4.97 (460),2 beds
Home in Waxhaw,Fox Farms Little House,May 1 - 6,107.00,,4.97 (430),2 beds
Apartment in Miami,Retro 1BR Apt #3 | Steps from the Water + Parking!,May 1 - 6,106.00,,4.88 (136),2 beds
Townhouse in Washington,North Capitol Hill Luxury Townhome in Perfect Location,May 1 - 6,135.00,,4.81 (538),1 queen bed
Room in Naples,Sunset Suite @ The Vanderbilt | Boutique~BnB,May 1 - 6,224.00,,4.96 (117),2 beds
Apartment in Washington,#3 Foggy Bottom/Georgetown Apartment,May 7 - 12,209.00,,4.82 (473),1 queen bed
Condo in Tybee Island,Direct Waterfront.Keyless entry.Dolphin watch.,May 1 - 6,220.00,,4.97 (279),2 beds
Room in Galveston,Tropicana Suite-Grand Manor Luxury Mansion Loft,May 1 - 6,104.00,,4.86 (494),2 beds
Home in Netarts,Retro Retreat by the Bay,May 1 - 6,136.00,,4.9 (201),4 beds
Apartment in Miami Beach,Ocean Drive Beach Front Studio,May 1 - 6,153.00,,4.56 (418),3 beds
Home in Cape Coral,Coastal Cape Home w/Heated Pool-Sleeps 6,May 1 - 6,125.00,,4.85 (75),1 queen bed
Home in Sedona,Local Sedona Humble Home,May 1 - 6,236.00,,4.91 (107),3 beds
Home in Los Angeles,"Hollywood paradise studio in house,owned entrance",May 1 - 6,103.00,,4.89 (367),2 beds
Room in Miami,Luxe guest suite-perfect Staycation Pool & Parking,May 1 - 6,101.00,,4.91 (651),4 beds
Home in The Sea Ranch,Casa Del Mar Spectacular Ocean Views!,May 1 - 6,434.00,,4.97 (148),3 beds
Apartment in Brooklyn,Cozy Garden Apartment,May 1 - 6,117.00,,4.93 (287),3 beds
Cottage in Eastham,Classic Cape Cod Cottage,May 1 - 6,143.00,,4.92 (172),3 beds
Home in Las Vegas,Modern 3 bds house with pool in Las Vegas,May 1 - 7,313.00,,5.0 (10),3 beds
Home in Gulfport,Gecko House Unit #1,May 1 - 6,88.00,,4.88 (113),1 king bed
Apartment in Sunny Isles Beach,LOVELY OCEAN VIEW 1BD/1.5TH APT HIGH FLOOR|PARKING,May 4 - 9,148.00,,4.85 (47),2 beds
Room in New York,spacious chelsea room,May 1 - 6,106.00,,4.9 (127),3 beds
Guest suite in Naples,Tropical Garden Studio Cottage (2 miles to beach),May 1 - 6,119.00,,4.97 (231),1 queen bed
Guesthouse in Portland,Cozy Portland Studio Apartment,May 1 - 6,104.00,,4.98 (745),2 beds
Apartment in Pompano Beach,Direct beautiful beach and ocean view,May 1 - 6,173.00,,4.93 (124),3 beds
Condo in Hollywood,Beach paradise. Just minutes to restaurants shops.,May 1 - 6,320.00,,4.89 (54),4 beds
Home in Palm Coast,Spacious Heated Pool home with pool/pingpong table,May 1 - 6,212.00,,4.93 (138),2 beds
Guesthouse in Rockaway Beach,The Strand Oceanview Studio - Dog Friendly!,May 1 - 6,121.00,,4.85 (392),6 beds
Home in Lehigh Acres,Enjoy the most beautiful sunsets by the *pool,May 1 - 6,113.00,,4.93 (42),1 queen bed
Apartment in Carmel-by-the-Sea,Private romantic 1 br in Carmel Woods- love dogs,May 1 - 6,149.00,,4.86 (743),2 beds
