Title,Detail,Date,Price(in dollar),Offer price(in dollar),Review and rating,Number of bed
"Island in El Nido, Philippines","Exclusive Private Island + Brother Island, El Nido",Jun 1 - 6,469.00,,4.82 (131),11 beds
"Room in Chom Phon, Thailand",15min walk to MRT Private room for 3 Free Brekkie.,Jun 24 - 29,31.00,,4.9 (255),3 double beds
"Villa in Kecamatan Ubud, Indonesia",Elegant & luxurious 3 BR villa rice-fields pano,Jun 21 - 26,322.00,,4.65 (94),4 beds
"Villa in Tabanan, Indonesia",Exclusive Beach Villa - Balian Beach,Jun 1 - 6,240.00,,4.8 (105),4 beds
"Villa in Singaraja, Indonesia","180° VIEW, PRIVATE POOL VILLA..",Jun 11 - 16,206.00,,4.93 (355),1 bed
"Apartment in Phuket, Thailand, Thailand",White Breeze Pool 1BD Apartment,Jun 4 - 10,64.00,,4.69 (112),1 queen bed
"Villa in Nusa Ceningan, Indonesia",Beautiful villa on the edge of BLUE LAGOON,Jun 1 - 6,264.00,,4.83 (1239),1 bed
"Villa in Kecamatan Ubud, Indonesia",Intimate Private Pool Villas in Ubud center,Jun 7 - 12,209.00,,4.89 (223),1 double bed
"Hut in Kecamatan Ubud, Indonesia",50% OFF | Ipian Cinta with Private Pool jacuzzi,Oct 28 - Nov 2,142.00,,4.62 (118),1 double bed
"Villa in Kecamatan Kuta Utara, Indonesia",Love Nest for honeymooner at best location,Sep 3 - 8,251.00,,4.98 (87),1 bunk bed
"Earthen home in Mueang Chiang Mai District, Thailand",Leafy Greens Chiangmai : Mushroom M2,Jun 13 - 20,22.00,,4.87 (210),1 bunk bed
"Villa in Kecamatan Kuta Utara, Indonesia",Love Nest for honeymooner at best location,Sep 3 - 8,251.00,,4.98 (87),1 double bed
"Villa in Payangan, Indonesia",❣️Secluded Getaway Staycation+SunsetPool@megananda,Nov 6 - 11,111.00,,4.89 (364),1 king bed
"Earthen home in Mueang Chiang Mai District, Thailand",Leafy Greens Chiangmai : Mushroom M2,Jun 13 - 20,22.00,,4.87 (210),1 bunk bed
"Villa in Ubud, Kabupaten Gianyar, Indonesia",#3# Beautiful Balinese Villa with Private Pool,Nov 12 - 17,137.00,,4.91 (434),1 queen bed
"Villa in เกาะพงัน, Thailand","Palma Villa, Spectacular Sea View Villa with Pool",Jul 17 - 22,238.00,,5.0 (13),2 beds
"Villa in Tegallalang, Indonesia",Luxurious Private Pool Villa with Garden North of Ubud,Oct 14 - 19,126.00,,4.92 (166),2 beds
"Tiny home in Kecamatan Ubud, Indonesia",Tiny Tall Haus Ubud Getaway!,Jun 26 - Jul 1,95.00,,4.87 (104),1 queen bed
"Bungalow in Ubud, Indonesia",Pondok Prapen -Ubud Center Private Pool Villa,Jun 15 - 20,217.00,,4.89 (333),3 beds
"Villa in Tampaksiring, Indonesia",Beetle - Bamboo Villa in Eco Six Bali Resort,Oct 28 - Nov 2,458.00,,4.82 (82),2 king beds
"Home in Ko Samui, Thailand",the naked house,Jun 5 - 10,205.00,,4.88 (183),7 beds
"Villa in Kamala, Thailand","""Villa Sauvage 2 br"" - a magic horizon of coziness",Jun 6 - 11,122.00,,4.57 (115),2 double beds
"Home in Mabini, Philippines",Bathing Private Exclusive Cottage,Jun 12 - 17,183.00,,4.91 (181),6 beds
"Hut in Abiansemal, Indonesia",Zen Hideaway #3 - ultimate Wabi-sabi experiences,Jul 30 - Aug 4,235.00,,4.8 (372),2 king beds
"Tiny home in Cavinti, Philippines","Explore, Experience, Enjoy T-HOUSE Lakestaycation!",Jun 2 - 7,39.00,,4.43 (160),2 queen beds
"Hut in Tampaksiring, Indonesia",Hidden Bamboo Bali,Nov 8 - 13,136.00,,4.91 (161),1 king bed
"Room in Kecamatan Denpasar Selatan, Indonesia",Poolside room in large villa. 5 minutes to beach.,Aug 10 - 16,34.00,,5.0 (37),1 king bed
"Room in Bangkok, Thailand",Ba hao Residence x MAITRI CHIT ROOM,Aug 15 - 20,96.00,,4.93 (431),1 king bed
"Boutique hotel in Ko Samui, Thailand",Pool Villa by Humble,Jun 15 - 20,63.00,,4.93 (105),1 king bed
"Apartment in Muang Pattaya, Thailand",[VR] 2BR High Skyline Ocean View @ Pattaya,Jun 5 - 10,136.00,62.00,4.69 (85),3 beds
"Home in Kuta, Indonesia",Villa Seminyak 1 Bedroom 10 Mins to Beach,Jun 11 - 16,69.00,55.00,4.67 (340),1 king bed
"Villa in Ko Lanta District, Thailand","DEEPSPACE villa X1 ,Secret Address on Quiet Beach",Jun 6 - 11,164.00,24.00,4.7 (47),3 beds
"Place to stay in Balian Beach, Indonesia",BALIAN TREEHOUSE 2 - with private pool,Jul 21 - 28,131.00,39.00,4.89 (140),3 beds
"Villa in Thành phố Hội An, Vietnam",Private pool two bedroom villa - villa the cow,Jun 3 - 8,97.00,53.00,4.8 (124),2 double beds
"Apartment in 清迈, Thailand",清迈 The Astra Condo长康路无边泳池豪华公寓古城夜市边Chang Khlan road,Jun 12 - 17,33.00,809.00,4.68 (158),1 queen bed
"Place to stay in Thành phố Hội An, Vietnam",Garden view twin room with breakfast-Ngan Phu,Jun 10 - 17,24.00,116.00,4.85 (255),2 single beds
"Room in Sidemen, Indonesia",Heritage of Art Villa Iseh in Sidemen East Bali,Jun 1 - 6,154.00,99.00,4.89 (111),1 queen bed
"Apartment in Tambon Patong, Thailand",One-Bedroom Suite in Patong Beach,Jun 9 - 14,49.00,,4.73 (67),2 king beds
"Condo in Khet Watthana, Thailand","【CENTRAL STUDIO】0-min BTS ASOK, FAST WIFI, NETFLIX",Jun 1 - 6,58.00,,4.74 (252),4 beds
"Villa in Koh Yao Noi, Thailand","Eagles Nest, Luxury Villa, Koh Yao Noi",Jun 1 - 6,986.00,,4.95 (43),22 beds
"Hotel room in Thành phố Hội An, Vietnam",FIG TREE BOUTIQUE VILLA,Jun 1 - 6,30.00,,4.83 (92),3 queen beds
"Earthen home in Ao nang, Thailand",Seaview Bedrock Home,Jun 1 - 6,131.00,,4.8 (35),3 beds
"Villa in Langkawi, Malaysia",Alamanda Tropical Wooden Villa - Pool View,Jun 15 - 20,97.00,,4.87 (196),2 beds
"Villa in Koh Lanta Island, Thailand",Perch Villa - Clifftop villa spectacular sea view,Jun 6 - 11,162.00,,4.94 (71),1 bed
"Guesthouse in Kecamatan Kuta Utara, Indonesia",Tropical Private Room Canggu 3 by Rios Guest House,Aug 4 - 11,33.00,,4.86 (7),3 beds
"Villa in Rayong, Thailand","Luxury Beach Front Pool Villa, Phuphatara Rayong",Jun 6 - 11,359.00,,4.68 (85),1 double bed
"Cottage in Lamai Beach, Thailand",TROPICAL POOL BEACH VILLA III | Beach-Pool-Freedom,Jun 3 - 8,142.00,,4.92 (25),1 double bed
"Cabin in Kecamatan Ubud, Indonesia",Samu House. Tropical stay private pool.Adults Only,Sep 29 - Oct 4,108.00,110.00,4.84 (106),1 bed
"Villa in Tampaksiring, Indonesia",Romantic 1br Villa - Ubud Jungle,Dec 24 - 29,363.00,,5.0 (13),1 king bed
"Treehouse in Tampaksiring, Indonesia",umatreehouse,Nov 16 - 21,133.00,,4.93 (164),1 bed
"Treehouse in Ubud, Indonesia","Promo Price! Magical Treehouse, Stunning Views.",Aug 23 - 30,280.00,,4.78 (528),4 beds
"Bungalow in Nusapenida, Indonesia",Tropical Glamping 🌴 Cliff Side Ocean View + Net🐬,Oct 26 - 31,474.00,,4.93 (209),1 queen bed
"Treehouse in Klungkung, Indonesia",Cliffside Bamboo Treehouse - Private Pool & View,Nov 14 - 19,484.00,,5.0 (59),1 bed
"Cabin in Klungkung, Indonesia",Dreamy Cliffside Bamboo Villa with Pool and View,Nov 5 - 10,484.00,,4.98 (58),1 bed
"Cottage in Ubud, Indonesia",25%OFF! Romantic Honeymoon Escape in Ubud Paradise,Jun 28 - Jul 3,117.00,,4.77 (219),1 double bed
"Resort in Nusa Lembongan,, Indonesia",Acala Lembongan-Deluxe Suite Sea View,Oct 6 - 11,92.00,,4.63 (51),1 queen bed
"Villa in Ubud, Indonesia",NEW 5BR Luxury Villa in Ubud: Pool and Jungle View,Jun 20 - 25,451.00,,New,5 double beds
"Treehouse in Kabupaten Buleleng, Indonesia",Seaside Designer Treehouse ~ Stunning Views ~ Pool,Jun 13 - 18,121.00,,4.75 (4),1 bed
"Room in Kabupaten Buleleng, Indonesia",private villa with infinity pool hill and sea view,Oct 6 - 11,53.00,,4.8 (35),1 double bed
"Hut in Ubud, Indonesia",50% OFF | Ipian Jiwa Eco Bamboo Uniquely Escape,Oct 11 - 16,89.00,,4.67 (128),6 beds
"Villa in Bacnotan, La Union, Philippines","Private Modern Beachfront Villa: Pool, Sunset View",Jun 28 - Jul 3,628.00,,5.0 (15),9 beds
"Villa in Lian, Philippines",SoftLaunch IbizaInspiredBeachfrontVilla inBatangas,Jul 2 - 7,473.00,,4.91 (11),1 king bed
"Hotel in Kecamatan Ubud, Indonesia",Stunning Room Near Ubud Market - Outdoor Pool!!,Sep 14 - 20,44.00,,4.78 (358),1 bed
"Hotel in Tambon Ratsada, Thailand",Hotel Room with Private Plunge Pool Siray Bay#2,Jun 13 - 18,71.00,,5.0 (13),1 bed
"Guest suite in Bingin Beach, Indonesia",Suite 2 - Beachfront Luxury Suite on Bingin Beach,Oct 16 - 21,267.00,,4.93 (96),1 bed
"Villa in Bacnotan, La Union, Philippines","Private Modern Beachfront Villa: Pool, Sunset View",Jun 28 - Jul 3,628.00,189.00,5.0 (15),6 beds
"Loft in Seminyak, Indonesia",TROPICAL - DESIGNER LOFT - Seminyak,Sep 26 - Oct 1,220.00,102.00,4.98 (113),1 king bed
"Villa in Lian, Philippines",SoftLaunch IbizaInspiredBeachfrontVilla inBatangas,Jul 2 - 7,473.00,132.00,4.91 (11),9 beds
"Hotel in Tambon Ratsada, Thailand",Hotel Room with Private Plunge Pool Siray Bay#2,Jun 13 - 18,71.00,,5.0 (13),1 bed
"Guest suite in Bingin Beach, Indonesia",Suite 2 - Beachfront Luxury Suite on Bingin Beach,Oct 16 - 21,267.00,,4.93 (96),3 king beds
"Treehouse in Klungkung, Indonesia",3 Bdr - The Dream Cliffside Bamboo Villa By Avana,Aug 3 - 8,913.00,,4.97 (30),1 bed
"Villa in Kecamatan Ubud, Indonesia",Madara Ubud Villas,Aug 2 - 7,194.00,,4.83 (129),2 beds
"Shipping container in Tambon Bo Put, Thailand",New 2BR+2Bath Eco Home,Jul 24 - 29,53.00,,4.73 (11),2 beds
"Place to stay in Penebel, Indonesia",Le Aiken Xperience - Unique Bamboo House,Aug 30 - Sep 4,252.00,,4.69 (94),2 beds
"Home in Kecamatan Tampaksiring, Indonesia",Six-Bamboo Villa in Eco Six Bali Resort,Sep 30 - Oct 6,458.00,,5.0 (5),1 bed
"Home in Kecamatan Kuta Selatan, Indonesia",One-Bedroom Villa Suite Deluxe,Sep 24 - 29,229.00,,4.95 (20),1 queen bed
"Treehouse in Tegallalang, Indonesia",Enchanted Hobbit Treehouse Nestled in the Jungle,Oct 17 - 24,207.00,,4.92 (117),1 king bed
"Home in Tegallalang, Indonesia",Romantic hideaway for two,Oct 25 - 30,33.00,,4.97 (229),2 beds
"Apartment in Nasugbu, Philippines",PICO DE LORO ( Santorini Vibe),Jun 25 - 30,112.00,,4.88 (16),4 beds
"Villa in Kecamatan Tampaksiring, Indonesia",*NEW* Lovely New 3BR Villa Stunning Jungle View,Sep 12 - 17,381.00,,4.7 (69),1 bed
"Villa in South Kuta, Indonesia",Nalu Bingin - 1 Bedroom Villa,Sep 25 - 30,202.00,,5.0 (5),2 beds
"Villa in Kecamatan Ubud, Indonesia",Pelangi Treehouse (formerly Skai Joglo),Sep 25 - 30,229.00,,4.92 (112),1 queen bed
"Place to stay in Pecatu, Indonesia",°3 Charming room in Bingin beach,Sep 10 - 15,155.00,,4.52 (523),1 queen bed
"Villa in Ubud, Indonesia","Luxe Villa in Tropical Oasis, Ubud. Walk to town.",Oct 28 - Nov 2,176.00,363.00,4.93 (287),1 king bed
"Villa in Banjar, Indonesia",4br Lovina Paradise - Ocean View,Jun 9 - 14,460.00,275.00,4.93 (40),4 king beds
"Condo in Johor Bahru, Malaysia","Baby & kids friendly, JB CIQ, Romantic Duplex",Jun 25 - 30,75.00,229.00,4.82 (182),2 beds
"Tiny home in Concepcion, Philippines",Tiny House by The Modern Escape,Jul 3 - 8,128.00,103.00,5.0 (32),2 beds
"Villa in Kecamatan Kuta Utara, Indonesia",Gorgeous luxury 1 bedroom villa in heart of Canggu,Sep 9 - 14,325.00,,4.87 (47),1 bed
"Villa in Kecamatan Seririt, Indonesia",Boho-Chic villa with ocean&rice field view,Sep 28 - Oct 3,201.00,,4.97 (67),3 queen beds
"Villa in Ubud, Indonesia",Ceylon Villas 4 - 1BR Villa! 5 mins to Ubud 🌴,Nov 23 - 28,125.00,,4.92 (184),1 bed
"Place to stay in Kecamatan Kuta Selatan, Indonesia",Gypsea Bali Bungalow with private bathroom and AC,Sep 11 - 16,155.00,,4.92 (78),1 king bed
"Hut in Kecamatan Ubud, Indonesia","DAY CLOUDS, Ubud",Jul 20 - 25,72.00,,4.59 (122),1 bed
"Cabin in Amadeo, Philippines",Cozy Loft Cabins Near Tagaytay,Aug 7 - 13,252.00,,4.88 (43),8 beds
"Place to stay in Tabanan, Indonesia",Ocean View and Private Pool at Balian Beach,Jul 23 - 28,116.00,,4.82 (122),1 queen bed
"Cabin in Kecamatan Sukasada, Indonesia",Wanagiri Cabin,Nov 1 - 7,148.00,,4.97 (29),2 beds
"Place to stay in Nusapenida, Indonesia",Batan Sabo Cottage,Sep 27 - Oct 2,72.00,,4.72 (459),1 queen bed
"Treehouse in Kecamatan Ubud, Indonesia",Bamboo Turtle cabin river view 5km to Ubud center,Jul 9 - 14,118.00,,4.88 (75),1 bed
"Home in Kecamatan Ubud, Indonesia",PROMO! Luxury Villa Escape in Ubud 2 BR,Sep 1 - 6,306.00,,5.0 (4),2 beds
"Apartment in Candidasa, Indonesia",Villa Sea Spray Bali Cowrie literally on the Ocean,Aug 19 - 24,130.00,,4.79 (112),2 beds
"Home in Kecamatan Selat, Indonesia",The Nude House,Jul 10 - 15,305.00,,4.68 (19),2 beds
"Villa in Kathu, Thailand",Tiny Poolvilla in the heart of Phuket,Jul 25 - 30,119.00,,5.0 (98),1 king bed
"Treehouse in Kecamatan Ubud, Indonesia",Bamboo Turtle cabin river view 5km to Ubud center,Jul 9 - 14,118.00,172.00,4.88 (75),1 bed
"Home in Kecamatan Ubud, Indonesia",PROMO! Luxury Villa Escape in Ubud 2 BR,Sep 1 - 6,306.00,63.00,5.0 (4),2 beds
"Home in Kecamatan Selat, Indonesia",The Nude House,Jul 10 - 15,305.00,,4.68 (19),2 beds
"Villa in Kathu, Thailand",Tiny Poolvilla in the heart of Phuket,Jul 25 - 30,119.00,,5.0 (98),1 king bed
"Apartment in Kuala Lumpur, Malaysia",Instagrammable Loft Studio in EkoCheras KL,Jul 9 - 14,60.00,,4.94 (84),1 double bed
"Villa in Kecamatan Banjar, Indonesia",❤PROMO Beachfront oasis. Private pool and firepit,Jun 16 - 21,189.00,,4.74 (46),4 beds
"Condo in Federal Territory of Kuala Lumpur,, Malaysia",Arte Mont Kiara Muji Suites,Jun 4 - 11,51.00,,4.59 (406),3 beds
"Villa in Tagaytay, Philippines",My Canopy Tagaytay (with thermal pool),Sep 17 - 22,424.00,,4.91 (81),17 beds
"Room in UbudUbud, Gianyar, Indonesia",Luxe Suite: Villacellabella Ubud Bali Instaworthy,Jun 26 - Jul 1,490.00,,4.92 (167),1 double bed
"Apartment in phường 6, Vietnam",CITY APART ★ CENTRAL City-FREE Pool & Gym,Jun 1 - 6,31.00,,4.64 (96),1 king bed
"Place to stay in Ubud, Indonesia",Villa Akasha - Bio-Architected Eco Dome,Sep 19 - 24,86.00,,4.65 (303),1 queen bed
"Resort in Lian, Philippines",#1Beach Front Villa room Villa Blanca Beach Front,Jun 4 - 9,71.00,,4.58 (114),1 queen bed
"Villa in Ubud, Indonesia",Luxury 1 BR Villa w/ Private Pool & Ricefield View,Oct 25 - 30,92.00,,4.95 (208),4 queen beds
"Apartment in Melaka, Malaysia",Yuma • Atlantis Melaka/3BR 8Pax WiFi Balcony SeaView,Jun 18 - 23,40.00,,4.43 (7),2 king beds
"Villa in Tampaksiring, Indonesia",Ceylon Villas 1 - 2BR Villa! 5 mins to Ubud 🌴,Sep 27 - Oct 2,166.00,,4.89 (176),1 king bed
"Home in 頭城鎮, Taiwan","Newly furnished first row of seaview in Moon, sea view, perfect sunrise ~ long term rental welcome (also discounted)",Jul 9 - 14,155.00,,4.92 (216),2 king beds
"Boutique hotel in Kathu District, Thailand",B Designer King Bed with Partial SEA VIEW bath,Jun 2 - 7,75.00,,4.5 (281),2 king beds
"Hut in Selat, Indonesia","Vaikuntha#3, The Pursuit of Perfect Rustic Beauty",Oct 15 - 20,201.00,,4.82 (146),2 king beds
"Resort in Tambon Maret, Thailand",DELUXE SEA VIEW + Hot Tub @Koh Samui,Jun 2 - 7,72.00,31.00,4.63 (16),1 bed
"Apartment in Bangkok, Thailand",Spacious Apt in City of Angels,Jun 8 - 13,19.00,46.00,4.95 (438),1 king bed
"Apartment in Phuket, Thailand","Luxury room & Sky pool, in Phuket town",Jun 8 - 13,40.00,73.00,4.81 (210),1 bed
"Tent in Kintamani, Indonesia",Mt Batur Sunrise & overnight,Jun 11 - 16,42.00,,4.97 (29),1 bed
"Place to stay in Nusa Penida, Indonesia",Tide 2 in Penida Tides Cottage,Jul 29 - Aug 3,32.00,,4.85 (68),1 king bed
"Villa in Ubud, Indonesia",Ceylon Villas 2 - 2BR Villa! 5 mins to Ubud 🌴,Oct 12 - 17,157.00,,4.88 (112),2 king beds
"Room in Kabupaten Badung, Indonesia",Private room4 Legian/breakfast/close to Kuta beach,Jun 6 - 11,81.00,,4.91 (34),1 bed
"Villa in Karangasem, Indonesia","Luxury Ocean Front, 2,500sq ft Private Eco Villa!",Jun 16 - 21,450.00,,4.96 (24),1 double bed
"Apartment in PHUKET, Thailand",★Studio in Seafront Private Villa w/infinity pool★,Jun 30 - Jul 5,53.00,,4.83 (93),3 beds
"Condo in Na Chom Thian, Thailand",Veranda Residence pattaya 2bedroom partial seaview,Jun 6 - 11,83.00,,4.89 (186),2 beds
"Home in Hua Hin, Thailand",Cool Home w Garden near Sea,Jul 6 - 11,77.00,,4.81 (360),2 beds
"Loft in Pasig, Philippines",Cozy & Modern Loft w/ high speed wi-fi and Netflix,Jul 5 - 10,35.00,,4.92 (196),1 king bed
"Apartment in Phuket, Thailand",Cozy Place near Shopping Center,Jun 20 - 25,35.00,,4.96 (237),2 king beds
"Home in Tabanan, Indonesia",Ocean View Pool Villa @ Balian Beach,Jun 8 - 13,170.00,,4.76 (282),1 queen bed
"Villa in General Luna, Philippines",Oceanfront Pool Villa,Jul 30 - Aug 5,163.00,,4.96 (23),2 beds
"Condo in George Town, Malaysia",Lovely 1 Bedroom Suite with Pool View,Jun 5 - 10,26.00,,4.27 (56),3 beds
"Home in Santander, Philippines",Private Beach House. The Shack,Jun 11 - 18,89.00,,4.88 (41),1 king bed
"Treehouse in Bali, Indonesia",Lounge Poolside Under Lush Greenery at an Organic Bamboo Pad,Jul 3 - 8,69.00,,4.71 (98),1 king bed
"Apartment in Phuket, Thailand","Luxury room & Sky pool, in Phuket town",Jun 8 - 13,40.00,31.00,4.81 (210),1 bed
"Place to stay in Nusa Penida, Indonesia",Tide 2 in Penida Tides Cottage,Jul 29 - Aug 3,32.00,46.00,4.85 (68),1 king bed
"Apartment in Kuala Lumpur, Malaysia",Walk to Petronas Towers from a Stylish Apartment,Jun 5 - 10,71.00,182.00,4.89 (296),1 king bed
"Room in Kabupaten Badung, Indonesia",Private room4 Legian/breakfast/close to Kuta beach,Jun 6 - 11,81.00,,4.91 (34),1 bed
"Villa in Karangasem, Indonesia","Luxury Ocean Front, 2,500sq ft Private Eco Villa!",Jun 16 - 21,450.00,,4.96 (24),1 double bed
"Apartment in PHUKET, Thailand",★Studio in Seafront Private Villa w/infinity pool★,Jun 30 - Jul 5,53.00,,4.83 (93),3 beds
"Condo in Na Chom Thian, Thailand",Veranda Residence pattaya 2bedroom partial seaview,Jun 6 - 11,83.00,,4.89 (186),2 beds
"Home in Hua Hin, Thailand",Cool Home w Garden near Sea,Jul 6 - 11,77.00,,4.81 (360),2 beds
"Hotel room in Gili Trawangan, Indonesia",Coconut Garden Resort Gili Trawangan,Jul 24 - 30,69.00,,4.84 (242),1 king bed
"Loft in Pasig, Philippines",Cozy & Modern Loft w/ high speed wi-fi and Netflix,Jul 5 - 10,35.00,,4.92 (196),2 king beds
"Tiny home in Kabupaten Tabanan, Indonesia",Balian Beachfront Luxury Tiny House,Jun 5 - 10,186.00,,5.0 (19),4 beds
"Home in Tabanan, Indonesia",Ocean View Pool Villa @ Balian Beach,Jun 8 - 13,170.00,,4.76 (282),1 queen bed
"Apartment in Port Dickson, Malaysia",PD D'Wharf Premium Suite - Full Seaview (4-6 Pax),Jun 8 - 15,54.00,,4.88 (129),1 king bed
"Villa in General Luna, Philippines",Oceanfront Pool Villa,Jul 30 - Aug 5,163.00,,4.96 (23),1 king bed
"Treehouse in Bali, Indonesia",Lounge Poolside Under Lush Greenery at an Organic Bamboo Pad,Jul 3 - 8,69.00,,4.71 (98),2 beds
"Apartment in PHUKET, Thailand",Studio in Beachfront Private Villa w/Infinity pool,Jun 18 - 23,38.00,,4.88 (64),2 beds
"Room in Phuket, Thailand",Grand Seaview Pool Suite •,Jun 1 - 6,111.00,,4.85 (26),2 beds
"Home in ตำบล บ้านใต้, Thailand","❤️THE LOFT, Romantic Beachfront Home, HIN KONG.",Aug 18 - 23,198.00,,4.96 (56),2 beds
"Home in ตำบล บ้านใต้, Thailand","❤️THE LOFT, Romantic Beachfront Home, HIN KONG.",Aug 18 - 23,198.00,182.00,4.96 (56),2 beds
"Apartment in Kecamatan Senen, Indonesia",5* Studio Resort like: Mason Place Capitol Park,Jun 8 - 13,29.00,25.00,4.95 (112),2 queen beds
"Home in Lembang, Indonesia",Minimax House by wiandra,Jun 3 - 8,96.00,32.00,4.84 (81),4 beds
"Condo in Melaka, Malaysia",B1731/Seaview/5 mine drive to Jonker/Imperio/4 pax,Jun 13 - 19,23.00,33.00,4.54 (209),3 beds
"Loft in George Town, Malaysia",*6Maritime Seafront Scandinavian Home‖北欧风格日出无敌海景套房,Jun 1 - 7,153.00,,4.39 (380),3 double beds
"Condo in Cebu City, Philippines",Scenic Cebu City View Condo in Ayala,Jun 16 - 21,41.00,,4.98 (315),2 queen beds
"Bungalow in Naiyang Beach, Thailand","Baan Rom Pruk private house, near Naiyang beach",Jun 5 - 10,26.00,,4.96 (172),1 king bed
"Condo in Quận 4, Vietnam",10' walk to Bitexco D1 45sqm Studio - Stay&Fun 01,Jun 2 - 7,38.00,,4.8 (163),1 queen bed
"Villa in Abiansemal, Indonesia",Ayung Panorama. Poetic house on Ayung River cliff,Aug 27 - Sep 1,159.00,,4.91 (227),2 king beds
"Room in Ko Samui District, Thailand",Villa The Spot - Room B6,Jun 3 - 8,127.00,,4.75 (28),1 bed
"Condo in Bayan Lepas, Malaysia",Cozy Seafront Studio Suite Near Queensbay,Jun 25 - 30,52.00,,4.83 (263),1 bed
"Hut in Kecamatan Selat, Indonesia",GLAMPING Experience with an INFINITY POOL,Jun 22 - 27,79.00,,4.8 (45),2 beds
"Condo in Tambon Na Chom Thian, Thailand",Veranda Residence pattaya 1BR partial sea view,Jun 5 - 10,47.00,,4.8 (95),2 queen beds
"Apartment in Kuala Lumpur, Malaysia",1min KLCC Twin Tower & Pavilion/Ins cottage for best memories,Jun 25 - 30,38.00,,4.91 (278),2 beds
"Cabin in Selat, Indonesia",Nyan Bali -A Bamboo House Escape with Private Chef,Dec 1 - 6,237.00,,4.95 (104),2 queen beds
"Condo in Cebu City, Philippines",5-Star Experience at the Heart of Cebu,Aug 9 - 16,49.00,,4.96 (280),3 beds
"Bungalow in Antipolo, Philippines",Antipolo - Secluded and Romantic,Jun 4 - 9,143.00,,4.87 (478),3 beds
"Room in San Juan, Philippines",Alon and Sandy Surf Shack GFloor (Air Conditioned),Jun 10 - 16,129.00,,4.62 (145),3 beds
"Room in Botolan, Philippines",The Blue Cabin #Beach,Jun 3 - 8,62.00,21.00,4.85 (59),1 queen bed
"Condo in Manila, Philippines","Amazing Manila Bay View! Spacious Comfy, Clean *31",Jun 11 - 16,69.00,177.00,4.9 (154),2 beds
"Apartment in Thalang, Thailand",Luxurious private 2bedrm seafront Phuket penthouse,Sep 2 - 7,286.00,57.00,4.92 (185),2 beds
"Condo in Tagaytay, Philippines",Serenity Tagaytay Home w/ WIFI & NETFLIX,Jun 11 - 16,30.00,34.00,4.79 (447),3 beds
"Apartment in Melaka, Malaysia",B1933B/5 min drive to Jonker/Seaview/Imperio/4 pax,Jun 18 - 24,24.00,47.00,4.69 (196),4 beds
"Villa in Phu Quoc, Vietnam",H&B Villas Phu Quoc - 3 Bedrooms,Jun 1 - 6,252.00,,5.0 (20),4 beds
"Condo in Pasig, Philippines",A Chic and Cozy 2Br Unit w/ Netflix and Disney+,Jun 4 - 9,34.00,,4.94 (295),6 beds
"Loft in George Town, Malaysia",Coastline Seaview Duplex Level 19 Executive Floor,Jun 4 - 9,87.00,,4.92 (437),1 king bed
"Cabin in Tambon Ko Pha-ngan, Thailand","BOHO CABIN, Hin Kong Beachfront, West Coast.",Jul 7 - 12,132.00,,4.98 (44),2 beds
"Apartment in Tambon Kamala, Thailand",(A)Charming Pool Access One Bedroom Apartment,Jun 3 - 8,65.00,,4.82 (68),1 double bed
"Condo in Pasay, Philippines","One Bedroom Condo in Roxas Boulevard, Pasay City",Jun 7 - 12,30.00,,4.77 (332),8 beds
"Villa in Seririt, Indonesia",Wake up to the Sea of Bali: Beachfront luxury plus,Oct 10 - 16,194.00,,5.0 (139),1 queen bed
"Cabin in Lazi, Philippines",Enchanted River cabin w/private garden and kitchen,Aug 19 - 24,51.00,,4.85 (127),2 beds
"Condo in Cebu City, Philippines",Cozy City Condo at Horizons 101 [ W/ WIFI ].,Jun 5 - 10,26.00,,4.44 (220),2 beds
"Apartment in Tambon Patong, Thailand",SUNSET SEAVIEW DELUXE PATONG - POOL+TERRACE,Jun 25 - 30,64.00,,4.8 (159),4 beds
"Apartment in Tambon Rawai, Thailand",Appartment 140 sqm 6 people big terrace sea view,Jun 14 - 19,111.00,,4.91 (160),2 beds
"Condo in Chiang Mai, Thailand",Cozy room 48.5 sq.m @The Astra near Night market,Jun 7 - 12,45.00,,4.89 (190),1 king bed
"Apartment in Kuala Lumpur, Malaysia",EXPRESSIONZ-1Bedroom-Junior-Suite-KLCC-Sky-Pool,Jun 1 - 6,53.00,,4.78 (408),1 king bed
"Loft in George Town, Malaysia",Coastline Seaview Duplex Level 19 Executive Floor,Jun 4 - 9,87.00,16.00,4.92 (437),6 beds
"Hotel in Nha Trang, Vietnam",VENUE HOTEL-20% Superior City NiceWindow#Good Rate,Jun 4 - 9,17.00,177.00,4.35 (17),1 bed
"Farm stay in Gianyar, Indonesia","Bebalilodge, one bedroom house with private pool",Oct 30 - Nov 4,76.00,57.00,4.97 (153),1 bed
"Cabin in Tambon Ko Pha-ngan, Thailand","BOHO CABIN, Hin Kong Beachfront, West Coast.",Jul 7 - 12,132.00,34.00,4.98 (44),1 king bed
"Apartment in Tambon Kamala, Thailand",(A)Charming Pool Access One Bedroom Apartment,Jun 3 - 8,65.00,66.00,4.82 (68),2 beds
"Villa in Seririt, Indonesia",Wake up to the Sea of Bali: Beachfront luxury plus,Oct 10 - 16,194.00,47.00,5.0 (139),8 beds
"Cabin in Lazi, Philippines",Enchanted River cabin w/private garden and kitchen,Aug 19 - 24,51.00,22.00,4.85 (127),1 queen bed
"Condo in Cebu City, Philippines",Cozy City Condo at Horizons 101 [ W/ WIFI ].,Jun 5 - 10,26.00,,4.44 (220),2 beds
"Apartment in Tambon Patong, Thailand",SUNSET SEAVIEW DELUXE PATONG - POOL+TERRACE,Jun 25 - 30,64.00,,4.8 (159),2 beds
"Condo in Chiang Mai, Thailand",Cozy room 48.5 sq.m @The Astra near Night market,Jun 7 - 12,45.00,,4.89 (190),2 beds
"Condo in Tambon Thep Krasatti, Thailand",2 Bedrooms Beachfront on Maikhao Beach B#7F,Jun 1 - 6,90.00,,4.6 (65),2 beds
"Apartment in Kuala Lumpur, Malaysia",EXPRESSIONZ-1Bedroom-Junior-Suite-KLCC-Sky-Pool,Jun 1 - 6,53.00,,4.78 (408),1 king bed
"Apartment in Tambon Hua Hin, Thailand",La Casita Hua Hin 2,Jun 22 - 27,32.00,,4.75 (170),1 sofa bed
"Room in Tebet, Indonesia",The LOJI @ Patra Kuningan # 3,Jun 30 - Jul 5,24.00,,4.83 (69),2 beds
"Condo in Cebu City, Philippines",Cozy Studio across Ayala Mall iT Park 1min walk,Jul 20 - 25,26.00,,4.78 (235),1 bed
"Bungalow in Ko Samui, Thailand",B4: Sea Breeze Bungalow with Ensuite and AC,Jun 14 - 19,33.00,,4.82 (191),2 double beds
"Villa in Pemuteran, Indonesia","Villa Arun, Sumberkima Hill",Aug 21 - 26,262.00,,4.88 (57),1 queen bed
"Apartment in Quận 4, Vietnam",DANNY’s HIGH VIEW STUDIO near District1 Ben Thanh!,Jun 3 - 8,44.00,,4.78 (167),1 queen bed
"Apartment in Kuala Lumpur, Malaysia",Premier Lux Studio Large Tv Free Netflix | City,Jun 1 - 8,62.00,28.00,4.9 (166),2 king beds
"Cabin in Tambon Ko Pha-ngan, Thailand","BOHO CABIN, Hin Kong Beachfront, West Coast.",Jul 7 - 12,132.00,177.00,4.98 (44),1 king bed
"Condo in Johor Bahru, Malaysia",【R&F】Studio of Dual-Key Homely Getaway byⓗⓢ,Jun 4 - 9,44.00,57.00,4.78 (139),2 queen beds
"Apartment in Bangkok , Thailand","Luxury Q Chidlom Condo, BTS ChitLom, Siam,",Jun 1 - 8,90.00,34.00,4.79 (61),1 queen bed
"Apartment in Tambon Kamala, Thailand",(A)Charming Pool Access One Bedroom Apartment,Jun 3 - 8,65.00,22.00,4.82 (68),2 beds
"Villa in Seririt, Indonesia",Wake up to the Sea of Bali: Beachfront luxury plus,Oct 10 - 16,194.00,,5.0 (139),8 beds
